url;zeitpunkt;titel;preis;wohnflaeche;anz_zimmer;grundstueckflaeche;strasse;plz;stadt;stadtteil;kategorie;anz_stockwerke;zustand;keller;typ;baujahr;energieeffizienz;aussenbereich
https://www.immowelt.de/expose/25zw75w;2022-07-20 11:57:46.168264;Ihre Nachbarn werden staunen! Ein Bungalow der begeistert in Goslar OT Jerstedt;260490.0;128.0;6;550;Straße nicht freigegeben;38644;Jerstedt;;Einfamilienhaus;1 Geschoss;Zustand: Neubau ;;;;;
https://www.immowelt.de/expose/25yqz5t;2022-07-20 11:57:46.785415;Eigenheim trotz steigender Zinsen & Hausbaukosten... unser Town & Country Doppelhaus Mainz 128 in Goslar OT Jerstedt;248820.0;121.0;5;492;Straße nicht freigegeben;38644;Goslar;Jerstedt;;3 ;Zustand: Neubau ;;;;;
https://www.immowelt.de/expose/25dpn5w;2022-07-20 11:57:47.341925;Typisches Harzhaus als Mehrfamilienhaus mit viel Potential;230000.0;167.0;10;587;Straße nicht freigegeben;38644;GoslarOTHahnenklee;;Mehrfamilienhaus;;Zustand: gepflegt ;voll unterkellert ;;1904.0;;Terrasse 
https://www.immowelt.de/expose/25wy35c;2022-07-20 11:57:47.953193;Mehrfamilienhaus oder Ferienhaus in Zentrum  von Goslar-Hahnenklee !!!;465000.0;300.0;13;666;Theodor-Hein-Straße 6;38644;Goslar;Hahnenklee;Mehrfamilienhaus;3 ;;teilweise unterkellert ;;1900.0;;Terrasse, Garten, Gartenanteil, Balkon, Wintergarten 
https://www.immowelt.de/expose/2wkyg4w;2022-07-20 11:57:48.543233;Ehemaliges Gasthaus mit Café im Dornröschenschlaf;;578.61;30;2250;Hahnenkleer Strasse 2;38644;Goslar;Hahnenklee;Mehrfamilienhaus;4 ;;voll unterkellert ;Massivhaus;1963.0;G;Terrasse, Garten, Gartenmitbenutzung 
https://www.immowelt.de/expose/253x75w;2022-07-20 11:57:49.141355;Viel Wohnraum auf kleiner Fläche. Ihr Raumwunder in Goslar OT Jerstedt;208010.0;100.0;4;550;Straße nicht freigegeben;38644;Jerstedt;;;2 ;Zustand: Neubau ;;;;;
https://www.immowelt.de/expose/254nv5v;2022-07-20 11:57:49.778666;RMH Jerstedt - Gepflegtes Raumwunder mit Blick auf den Brocken;348000.0;101.55;6;217;Straße nicht freigegeben;38644;GoslarJerstedt;;Reihenmittelhaus;;Zustand: gepflegt ;;;1997.0;D;Terrasse 
https://www.immowelt.de/expose/24nww5m;2022-07-20 11:57:50.412140;SCHWINGE IMMOBILIEN Stade: Einfamilienhaus mit 132 m² Wohnfläche in Düdenbüttel zu verkaufen.;360000.0;132.0;5,5;557;Straße nicht freigegeben;21709;Düdenbüttel;;Einfamilienhaus;1 Geschoss;;;;1995.0;F;
https://www.immowelt.de/expose/25afr5u;2022-07-20 11:57:51.049253;Einfamilienhaus in Himmelpforten;325000.0;158.22;6;924;Straße nicht freigegeben;21709;Himmelpforten;;Einfamilienhaus;;;teilweise unterkellert ;;1961.0;H;Terrasse, Balkon 
https://www.immowelt.de/expose/24ztj5t;2022-07-20 11:57:51.693935;SCHWINGE IMMOBILIEN Stade: 177 m² Wohnhaus mit 3 Garagen und 1.405 m² Gartengrundstück zu verkaufen.;285000.0;177.0;5,5;1405;Straße nicht freigegeben;21709;Himmelpforten;Breitenwisch;Einfamilienhaus;1 Geschoss;;;;1964.0;;
https://www.immowelt.de/expose/25pke5t;2022-07-20 11:57:52.321753;***HIMMELPFORTEN***NEUWERTIGES REIHENHAUS ZU VERKAUFEN***;290000.0;83.5;3;239;Schulstraße 7b;21709;HimmelpfortenNiederelbe;;Reihenmittelhaus;;Zustand: Neubau ;nicht unterkellert ;;2018.0;C;Terrasse, Garten, Gartenanteil 
https://www.immowelt.de/expose/24m835a;2022-07-20 11:57:52.961130;SCHWINGE IMMOBILIEN Stade: 190 m² Wohnhaus mit 1.138 m² Grundstück in Düdenbüttel zu verkaufen.;299000.0;190.0;8;1138;Hauptstraße 12;21709;Düdenbüttel;;Mehrfamilienhaus;1 Geschoss;Zustand: gepflegt ;teilweise unterkellert ;;2004.0;H;Terrasse 
https://www.immowelt.de/expose/26ubt5c;2022-07-20 11:57:53.564635;Neuwertig, naturnah, ideal gelegen: Energieeffizienzhaus mit großem Garten, Terrasse u. Stellplatz;569000.0;150.0;5;948;Straße nicht freigegeben;21709;Düdenbüttel;;Einfamilienhaus;;;nicht unterkellert ;;2018.0;A+;
https://www.immowelt.de/expose/26pt955;2022-07-20 11:57:54.271304;Großes Einfamilienhaus in ruhiger Lage;539000.0;200.0;8;1096;Straße nicht freigegeben;21709;Düdenbüttel;;Einfamilienhaus;;Zustand: gepflegt ;;Massivhaus;2000.0;B;Terrasse, Garten, Gartenanteil 
https://www.immowelt.de/expose/26pad58;2022-07-20 11:57:54.899875;RESERVIERT! Sofort beziehbar! Moderner Bungalow in ruhiger Lage ;337000.0;102.0;4;580;Straße nicht freigegeben;21709;Himmelpforten;;Bungalow;;;teilweise unterkellert ;;1972.0;;Terrasse, Garten 
https://www.immowelt.de/expose/25fmp5n;2022-07-20 11:57:55.553854;Im Herzen von Himmelpforten!;875000.0;320.0;8;1095;Straße nicht freigegeben;21709;Himmelpforten;;Einfamilienhaus;;Zustand: Altbau (bis 1945) ;;;1900.0;D;
https://www.immowelt.de/expose/25ey45y;2022-07-20 11:57:56.213996;SCHWINGE IMMOBILIEN Stade: Wohnhaus mit über 200 m² Wohnfläche + Vollkeller + 1.235 m² Grundstück.;380000.0;205.0;6;1235;Mittelweg 1;21709;Düdenbüttel;;Einfamilienhaus;;;voll unterkellert ;;2016.0;C;Terrasse 
https://www.immowelt.de/expose/258zu5q;2022-07-20 11:57:56.854463;Courtagefrei: Sonniges Plätzchen am südöstlichen Ortsrand von Himmelpforten;360000.0;120.0;5;746;Straße nicht freigegeben;21709;HimmelpfortenNiederelbe;;Einfamilienhaus;;Zustand: gepflegt ;;;1977.0;F;Terrasse, Loggia 
https://www.immowelt.de/expose/25mc55y;2022-07-20 11:57:57.452194;SCHWINGE IMMOBILIEN Stade: Wohnhaus mit Nebengebäude in ruhiger Lage von Weißenmoor.;220000.0;110.0;5;1500;Straße nicht freigegeben;21709;Düdenbüttel;;Einfamilienhaus;;;;;1994.0;;
https://www.immowelt.de/expose/269mc54;2022-07-20 11:57:58.124937;Geräumiges und solides Einfamilienhaus in Alleinlage in 21709 Burweg-Blumenthal;296500.0;181.07;8;1250;Straße nicht freigegeben;21709;BurwegBlumenthal;;Einfamilienhaus;;;voll unterkellert ;;2005.0;C;Terrasse 
https://www.immowelt.de/expose/26gdb58;2022-07-20 11:57:58.717206;Idyllisch gelegenes Nurdachhaus mit Carport;276000.0;102.0;2;967;Straße nicht freigegeben;21709;Düdenbüttel;;Einfamilienhaus;;Zustand: gepflegt ;nicht unterkellert ;;1973.0;F;Terrasse, Balkon 
https://www.immowelt.de/expose/24rcf5l;2022-07-20 11:57:59.362697;SCHWINGE IMMOBILIEN Stade: Familienhaus mit über 220 m² Wohnfläche in Himmelpforten zu verkaufen.;459000.0;228.0;7;724;Straße nicht freigegeben;21709;Himmelpforten;;Einfamilienhaus;;;voll unterkellert ;;1990.0;E;Terrasse, Loggia 
https://www.immowelt.de/expose/26tlc56;2022-07-20 11:57:59.965080;„Chance to Invest“ für ein Neubauprojekt mit fertig entwickeltem Konzept für ein attraktives Wohn- und Geschäftshaus;465000.0;3000.0;k.A.;2800;Straße nicht freigegeben;21709;Himmelpforten;;Mehrfamilienhaus;;;;;2023.0;;Terrasse, Balkon 
https://www.immowelt.de/expose/2456n52;2022-07-20 11:58:00.658687;Neubauqualität nach vollständiger Kernsanierung - Einfamilienhaus in begehrter Wohnlage - Oldenburg;560000.0;135.0;5;700;Straße nicht freigegeben;26125;Oldenburg;Ofenerdiek;Einfamilienhaus;;;;;2022.0;;Terrasse 
https://www.immowelt.de/expose/26e2y54;2022-07-20 11:58:01.331090;Doppelhaushälfte direkt zum Einziehen in Ofenerdiek !;340000.0;110.0;4;483;Straße nicht freigegeben;26125;Oldenburg;Ofenerdiek;Doppelhaushälfte;;;;Massivhaus;1994.0;D;
https://www.immowelt.de/expose/26mzx54;2022-07-20 11:58:01.925599;vermietete Doppelhaushälfte in Ofenerdiek !;300000.0;94.0;4;483;Straße nicht freigegeben;26125;Oldenburg;Ofenerdiek;Doppelhaushälfte;;;;Massivhaus;1994.0;F;
https://www.immowelt.de/expose/25mjj5q;2022-07-20 11:58:02.511749;Stadtvilla in ruhiger Wohnlage von OL-Ofenerdiek (Objekt-Nr.: 6182);549000.0;128.57;4;600;Straße nicht freigegeben;26125;Oldenburg;Oldenburg;Einfamilienhaus;;;;;2012.0;E;
https://www.immowelt.de/expose/26wj85a;2022-07-20 11:58:03.093669;MODERNES WOHNKONZEPT;595900.0;154.9;6;470;Straße nicht freigegeben;26125;Oldenburg;Ofenerdiek;Einfamilienhaus;;Zustand: projektiert ;;;2023.0;;
https://www.immowelt.de/expose/26q4h5c;2022-07-20 11:58:03.752090;***EIN- ODER ZWEIFAMILIENWOHNHAUS*** in herrlicher Lage mit sonnenverwöhntem Garten in ruhiger Lage;660000.0;203.0;7;1096;Straße nicht freigegeben;26125;Oldenburg;Ofenerdiek;Einfamilienhaus;;;teilweise unterkellert ;;1969.0;F;Terrasse, Balkon 
https://www.immowelt.de/expose/267bj57;2022-07-20 11:58:04.396464;Zweifamilienhaus mit 1.100 m² Grundstück in idyllischer Lage von Oldenburg-Ofenerdiek zu verkaufen!;439000.0;244.0;7;1100;Straße nicht freigegeben;26125;Oldenburg;Ofenerdiek;Mehrfamilienhaus;;;voll unterkellert ;;2015.0;E;Terrasse, Balkon 
https://www.immowelt.de/expose/26e9657;2022-07-20 11:58:05.045658;RMH saniert von Privat mit 4,5 Zimmern;355000.0;109.0;4,5;164;Straße nicht freigegeben;26125;Oldenburg;Ohmstede;Reihenmittelhaus;2 ;;voll unterkellert, Dach ausgebaut ;;1957.0;;Garten, Terrasse 
https://www.immowelt.de/expose/25b3z5l;2022-07-20 11:58:05.703651;Gepflegte Doppelhaushälfte in Oldenburg-Nadorst (Obj.-Nr. 6149);429000.0;106.0;4;205;Straße nicht freigegeben;26125;Oldenburg;Oldenburg;Doppelhaushälfte;;Zustand: gepflegt ;;;1998.0;F;
https://www.immowelt.de/expose/25l5a5r;2022-07-20 11:58:06.361956;Neuwertige Doppelhaushälfte mit Carport in ruhiger Wohngebietslage in Oldenburg-Ofenerdiek;395000.0;108.0;4;169;Straße nicht freigegeben;26125;Oldenburg;OldenburgEtzhorn;Doppelhaushälfte;;;nicht unterkellert ;;2018.0;A;Terrasse 
https://www.immowelt.de/expose/26tj85a;2022-07-20 11:58:06.963535;OFFENHEIT TRIFFT AUF KLASSISCHE ARCHITEKTUR;549900.0;135.31;4;470;Straße nicht freigegeben;26125;Oldenburg;Ofenerdiek;Einfamilienhaus;;Zustand: projektiert ;;;2023.0;;
https://www.immowelt.de/expose/24hyg5q;2022-07-20 11:58:07.740415;Vermietete Doppelhaushälfte in attraktiver Wohnlage;399000.0;113.33;4;324;Straße nicht freigegeben;26125;Oldenburg;Ofenerdiek;Doppelhaushälfte;;;nicht unterkellert ;Massivhaus;1998.0;E;Terrasse, Garten 
https://www.immowelt.de/expose/26zs85a;2022-07-20 11:58:08.346117;Freistehendes Einfamilienhaus - Bungalow in Ohmstede zu verkaufen;385000.0;96.0;3;466;Straße nicht freigegeben;26125;Oldenburg;Oldenburg;Einfamilienhaus;;Zustand: gepflegt ;nicht unterkellert ;;1974.0;G;Terrasse 
https://www.immowelt.de/expose/249dx5s;2022-07-20 11:58:08.973775; Einfamilienhaus am Stadtrand von Oldenburg in ruhiger Wohnlage   R E S E R V I E R T !;250000.0;116.4;4;550;Straße nicht freigegeben;26125;Oldenburg;Nadorst;Einfamilienhaus;1 Geschoss;;;;1967.0;H;Garten, Terrasse, Gartenanteil 
https://www.immowelt.de/expose/25uvk5g;2022-07-20 11:58:09.627975;Repräsentatives Wohnhaus mit Einliegerwohnung od. Büro in OL-Etzhorn !;1280000.0;328.0;10;859;Straße nicht freigegeben;26125;Oldenburg;Etzhorn;Villa;;;nicht unterkellert, Dach ausgebaut ;;2012.0;;Terrasse, Garten 
https://www.immowelt.de/expose/26ttg5c;2022-07-20 11:58:10.360763;***EIN- ODER ZWEIFAMILIENWOHNHAUS*** in herrlicher Lage mit sonnenverwöhntem Garten in ruhiger Lage;660000.0;203.0;7;1096;Straße nicht freigegeben;26125;Oldenburg;Ofenerdiek;Mehrfamilienhaus;;;teilweise unterkellert ;;1969.0;F;Terrasse, Balkon 
https://www.immowelt.de/expose/25ysh5p;2022-07-20 11:58:11.014743;Freistehendes Einfamilienhaus in ruhiger Lage von OL/Ofenerdiek;365000.0;118.0;7;500;Straße nicht freigegeben;26125;Oldenburg;Ofenerdiek;Einfamilienhaus;;Zustand: gepflegt ;voll unterkellert ;Massivhaus;;;Terrasse 
https://www.immowelt.de/expose/25tw85r;2022-07-20 11:58:11.678902;Einfamilienhaus mit Wärmepumpe, PV- und Solaranlage;649000.0;138.22;6;559;Straße nicht freigegeben;26125;Oldenburg;Ofenerdiek;Einfamilienhaus;;Zustand: gepflegt ;;Passivhaus;2010.0;A+;Terrasse 
https://www.immowelt.de/expose/25ajf56;2022-07-20 11:58:12.248691;Bezugsfreies Reihenmittelhaus in der Gartensiedlung Ohmstede;295000.0;95.0;4;142;Straße nicht freigegeben;26125;Oldenburg;OldenburgOhmstede;Reihenmittelhaus;;;voll unterkellert ;Massivhaus;1957.0;;Terrasse 
https://www.immowelt.de/expose/26xj85a;2022-07-20 11:58:12.898912;DAS HAUS MIT DEM PLUS AM RAUM;649900.0;200.01;4;470;Straße nicht freigegeben;26125;Oldenburg;Ofenerdiek;Einfamilienhaus;;Zustand: projektiert ;;;2023.0;;
https://www.immowelt.de/expose/2xw794p;2022-07-20 11:58:13.540981; Durchdachte Architektur trifft auf Harmonie;555000.0;140.0;5;500;Straße nicht freigegeben;26125;Oldenburg;Ofenerdiek;Einfamilienhaus;2 ;Zustand: Neubau ;;KfW 55;2021.0;;Terrasse, Garten 
