url;zeitpunkt;titel;preis;wohnflaeche;anz_zimmer;grundstueckflaeche;strasse;plz;stadt;stadtteil;kategorie;anz_stockwerke;zustand;keller;typ;baujahr;energieeffizienz;aussenbereich
https://www.immowelt.de/expose/2622k5h;2022-07-24 14:12:46.679944;Luxuriöser Hightech Bungalow mit großem Grundstück;890000.0;230;5;1426;Straße nicht freigegeben;49134;Wallenhorst;Hollage;Bungalow;;;nicht unterkellert ;;2021;A+;Terrasse 
https://www.immowelt.de/expose/26b6n5g;2022-07-24 14:12:47.347471;Doppelhaushälfte (Erbpacht) in Bokel mit Blick in die Natur (Obj.-Nr.: 6182);285000.0;104;4;441;Straße nicht freigegeben;26215;Wiefelstede;Bokel;Doppelhaushälfte;;Zustand: gepflegt ;;;1997;E;
https://www.immowelt.de/expose/26s7x5g;2022-07-24 14:12:47.969620;Landhausanwesen mit Ferienwohnungen, ca.12.000 qm Grundstück - viele Extras;;317;13;12000;Straße nicht freigegeben;26215;Wiefelstede;Mollberg;Bauernhaus;;Zustand: Altbau (bis 1945) ;teilweise unterkellert ;Massivhaus;1918/2013;;Terrasse, Garten, Gartenanteil, Wintergarten 
https://www.immowelt.de/expose/26z8t5h;2022-07-24 14:12:48.656817;Einfamilienhaus mit Garage ;419000.0;207;5;875;Bachstr. 13;26215;Wiefelstede;;;2.0;;;;1981;D;Terrasse, Garten 
https://www.immowelt.de/expose/26cfk5h;2022-07-24 14:12:49.345413;Wiefelstede: Attraktives Einfamilienhaus mit großem Grundstück, Obj. 6211;379000.0;139;5;1229;Straße nicht freigegeben;26215;Wiefelstede;;Einfamilienhaus;;;teilweise unterkellert ;;2019;G;Terrasse 
