url;zeitpunkt;titel;preis;wohnflaeche;anz_zimmer;grundstueckflaeche;strasse;plz;stadt;stadtteil;kategorie;anz_stockwerke;zustand;keller;typ;baujahr;energieeffizienz;aussenbereich
https://www.immowelt.de/expose/25hxd59;2022-07-21 13:27:25.577706;Naturnahe Immobilie auf einem Grundstück mit Weitblick in Elbnähe;210000;132;8;1478;Straße nicht freigegeben;29490;NeuDarchau;;Einfamilienhaus;;Zustand: gepflegt ;voll unterkellert ;Massivhaus;1974;H;Terrasse, Balkon 
https://www.immowelt.de/expose/258895j;2022-07-21 13:27:26.341932;Wohnen direkt an der Elbe in Neu Darchau OT Katemin (TK-5875);259000;130;6;900;Straße nicht freigegeben;29490;NeuDarchauKatemin;;Einfamilienhaus;;Zustand: gepflegt ;voll unterkellert ;;1985;G;Terrasse 
https://www.immowelt.de/expose/26wbc5c;2022-07-21 13:27:27.198400;Idyllisches Domizil: Hier kommt Sie das Reh morgens besuchen!;215000;80;3,5;1396;Straße nicht freigegeben;29490;NeuDarchau;;Einfamilienhaus;;Zustand: renovierungsbedürftig / sanierungsbedürftig ;voll unterkellert ;Holzhaus;1981;;Terrasse, Wintergarten 
https://www.immowelt.de/expose/26c2s5e;2022-07-21 13:27:27.883493;Platz für zwei Generationen!;369000;215;11;278;Straße nicht freigegeben;31167;Bockenem;Nette;Mehrfamilienhaus;;;voll unterkellert ;;1920;E;
https://www.immowelt.de/expose/26rm65g;2022-07-21 13:27:28.635148;Das clevere Raumwunder 100 im kommenden Baugeb. in Bockenem.;208010;100;4;kA  Grundstücksfl  ;Ambergauring ;31167;Bockenem;;Einfamilienhaus;;Zustand: Neubau ;;Massivhaus;2022;;
https://www.immowelt.de/expose/25ge359;2022-07-21 13:27:29.348570;Stilvolles Wohnen im eleganten Stil. ***MIT GRUNDSTÜCK IN BOCKENEM***;332090;144.47;4;1251;Straße nicht freigegeben;31167;Bockenem;Groß Ilde;Stadthaus;2 ;Zustand: Erstbezug ;;Massivhaus;2022;;
https://www.immowelt.de/expose/25jyf5t;2022-07-21 13:27:30.048191;Schönes, großes Fachwerkhaus mit Garten und Ladengeschäft in Bockenem!;120000;227;9;468;Straße nicht freigegeben;31167;Bockenem;;;;;voll unterkellert ;;1850;;
https://www.immowelt.de/expose/26p9v5f;2022-07-21 13:27:30.774953;Perfekt für die große Familie, traumhafte Feldrandlage!;175000;140;7;733;Straße nicht freigegeben;31167;Bockenem;Volkersheim;Einfamilienhaus;;Zustand: gepflegt ;voll unterkellert ;Massivhaus;1971;G;Terrasse, Garten, Balkon 
https://www.immowelt.de/expose/26rr85g;2022-07-21 13:27:31.723327;Hier wartet Ihr Traumhaus auf Sie - in Volkersheim 31167, frisch renoviert, OHNE KÄUFERPROVISION!!;285000;140;5;409;Straße nicht freigegeben;31167;Bockenem;Volkersheim;Reihenendhaus;3 ;Zustand: renoviert / saniert ;voll unterkellert ;;1950;;Terrasse, Garten 
https://www.immowelt.de/expose/26x945b;2022-07-21 13:27:32.450427;Gepflegtes Haus sucht neue Familie;275000;148;6;765;Straße nicht freigegeben;31167;Bockenem;;Einfamilienhaus;;Zustand: Altbau (bis 1945) ;;;1953;E;
https://www.immowelt.de/expose/256hj5t;2022-07-21 13:27:33.290795;Historisches Wohnhaus mit Garten und Nebengebäude in ruhiger, naturnaher Lage;150000;130;7;479;Straße nicht freigegeben;31167;Bockenem;Bornum am Harz;Einfamilienhaus;;Zustand: renovierungsbedürftig / sanierungsbedürftig ;;;1900;H;
https://www.immowelt.de/expose/267dq5f;2022-07-21 13:27:34.098557;Gepflegtes Fachwerkhaus in Bockenem!;189000;117.91;8;290;Straße nicht freigegeben;31167;Bockenem;;Mehrfamilienhaus;;;teilweise unterkellert ;Massivhaus;1900;;Balkon 
https://www.immowelt.de/expose/24u485v;2022-07-21 13:27:34.866754;**Provisionsfrei** StadtVilla auf großem Grundstück;349000;252;9;1334;Straße nicht freigegeben;31167;Bockenem;Volkersheim;Villa;;Zustand: Altbau (bis 1945), gepflegt ;voll unterkellert ;;1936;E;Terrasse, Balkon 
https://www.immowelt.de/expose/267ec56;2022-07-21 13:27:35.665195;Fachwerkcharme in vielseitiger Lage: RMH mit Terrasse, Innenhof und großem Potenzial;89000;132;5;108;Straße nicht freigegeben;31167;Bockenem;;Reihenmittelhaus;;Zustand: gepflegt ;nicht unterkellert ;;1848;F;
https://www.immowelt.de/expose/2599w5u;2022-07-21 13:27:36.370999;Einfamilienhaus in ruhiger Lage;149000;110;5;282;Straße nicht freigegeben;31167;Bockenem;Störy;Einfamilienhaus;;;;;1924;F;
https://www.immowelt.de/expose/25lmw5g;2022-07-21 13:27:38.075554;Zentral wohnen in Bockenem;229000;115;6;540;Straße nicht freigegeben;31167;Bockenem;;Reihenmittelhaus;;;;;1922;F;
https://www.immowelt.de/expose/26xha5g;2022-07-21 13:27:38.846987;Mit unserem Bungalow schaffen Sie sich Luxus auf einer Etage!;397220;131;5;768;Straße nicht freigegeben;31167;Bockenem;Bönnien;Bungalow;1 Geschoss;Zustand: Erstbezug, Neubau ;;KfW 55, Massivhaus;2022;;Terrasse 
https://www.immowelt.de/expose/26grw5g;2022-07-21 13:27:39.546094;Zu Hause einfach genießen, Ihr Familienhaus in Bornum.;234260;124;5;kA  Grundstücksfl  ;Am Sportplatz;31167;Bockenem;Bornum am Harz;Einfamilienhaus;;Zustand: Neubau ;;Massivhaus;2022;;
https://www.immowelt.de/expose/25rq65y;2022-07-21 13:27:40.261669;Schönes, fast fertig modernisiertes Reihenendhaus in Volkersheim...;285000;140;5;409;Straße nicht freigegeben;31167;BockenemVolkersheim;;Reihenendhaus;;;;;1950;;
https://www.immowelt.de/expose/24d665w;2022-07-21 13:27:40.975292;Großzügiges Stadthaus mit viel Potenzial!;180000;200;7;500;Straße nicht freigegeben;31167;Bockenem;;;;Zustand: gepflegt ;voll unterkellert ;;1840;;
https://www.immowelt.de/expose/25wbt5y;2022-07-21 13:27:41.668881;Günstig ins eigene Haus;120000;110;3;448;Straße nicht freigegeben;31167;Bockenem;Nette;Einfamilienhaus;;Zustand: Altbau (bis 1945) ;;;1977;G;
https://www.immowelt.de/expose/25lya5h;2022-07-21 13:27:42.421300;Spitzenstandort in der ersten Reihe - Außenplätze möglich;174000;285;8;800;Straße nicht freigegeben;31167;Bockenem;;Mehrfamilienhaus;;Zustand: Altbau (bis 1945) ;voll unterkellert ;;1900;F;
https://www.immowelt.de/expose/2546t5z;2022-07-21 13:27:43.144394;"*RESERVIERT*  "" Mit handwerklichem Geschick ins Eigenheim""";249000;110;4;1534;Straße nicht freigegeben;27419;Sittensen;;Einfamilienhaus;;;teilweise unterkellert ;;1958;H;Terrasse 
https://www.immowelt.de/expose/25qmb5z;2022-07-21 13:27:43.922409;Stilvolle ländliche Villa - Top ruhige Lage - Platz für Erweiterungen vorhanden;5500000;330;8;4360;Straße nicht freigegeben;27419;Sittensen;;Villa;;;;Massivhaus, Minergie zertifiziert;1996;D;Terrasse, Garten 
https://www.immowelt.de/expose/25b9e5x;2022-07-21 13:27:44.601221;Einfamilienhaus in 27419 Wohnste;131000;152;k.A.;kA  Grundstücksfl  ;Straße nicht freigegeben;27419;Wohnste;;;;;;;;;
https://www.immowelt.de/expose/25cnh5u;2022-07-21 13:27:45.297543;Herrliches freistehendes  Einfamilienhaus mit parkähnlichem Grundstück in bester Lage von Sittensen;429000;117;4;934;Straße nicht freigegeben;27419;Sittensen;;Einfamilienhaus;1 Geschoss;;voll unterkellert ;Massivhaus;1976;;Terrasse 
https://www.immowelt.de/expose/268k45f;2022-07-21 13:27:45.979803;Einfamilienhaus in 27419 Wohnste, Hohe Luft;131000;152;7;2506;Straße nicht freigegeben;27419;Wohnste;;;;;voll unterkellert ;;1954;;
https://www.immowelt.de/expose/262j35g;2022-07-21 13:27:46.617773;Zwangsversteigerung Haus, Hohe Luft in Wohnste;131000;152;6;2506;Straße nicht freigegeben;27419;Wohnste;;Einfamilienhaus;;;;;;;
https://www.immowelt.de/expose/264h85e;2022-07-21 13:27:47.335129;Provisionsfrei - Freistehendes Haus mit vielen Möglichkeiten auf einem wunderschön angelegten Grundstück in bester Lage;495000;192;7;860;Straße nicht freigegeben;27419;Sittensen;;Einfamilienhaus;3 ;Zustand: renoviert / saniert ;voll unterkellert ;;1969;E;Terrasse, Garten 
https://www.immowelt.de/expose/25v7m5j;2022-07-21 13:27:48.116765;Ihr neues Zuhause mit Feldblick;340000;105;5;1258;Straße nicht freigegeben;27419;KleinMeckelsen;;Einfamilienhaus;;Zustand: gepflegt ;;Fertighaus;1973;H;Terrasse 
https://www.immowelt.de/expose/266ud5g;2022-07-21 13:27:48.835010;Handwerker aufgepasst - EFH in Sittensen;259000;113;5;1156;Straße nicht freigegeben;27419;Sittensen;Heidorn;Einfamilienhaus;;Zustand: renovierungsbedürftig / sanierungsbedürftig ;;;1956;;
https://www.immowelt.de/expose/269gg5c;2022-07-21 13:27:49.535356;Freies Einfamilienhaus und Mehrfamilienhaus und Baugrundstück und Mieteinnahme in Einem ;750000;kA  Wohnfläche  ;k.A.;1800;Hauptstraße 26;27419;GroßMeckelsen;;Einfamilienhaus;;Zustand: gepflegt ;;;;;
https://www.immowelt.de/expose/26jep5f;2022-07-21 13:27:50.226744;EFH in toller Siedlungslage und Nähe zum Grünen;369000;142.70;5;585;Straße nicht freigegeben;49134;Wallenhorst;Hollage;Einfamilienhaus;;Zustand: renovierungsbedürftig / sanierungsbedürftig ;teilweise unterkellert ;Massivhaus;1953;H;Terrasse, Garten 
https://www.immowelt.de/expose/26tdq52;2022-07-21 13:27:50.901305;Attraktives und modernisiertes 5-Zimmer-Reihenendhaus zum Kauf in Wallenhorst, Lechtingen von PrivatGeschmackvoll renoviertes Haus in Wallenhorst;349000;116;5;374;Straße nicht freigegeben;49134;Wallenhorst;Lechtingen;Reihenendhaus;2 ;;nicht unterkellert ;;1980;;Terrasse, Garten 
https://www.immowelt.de/expose/25xyc5j;2022-07-21 13:27:51.583700;*Blick auf die Lechtinger Windmühle inklusive* Attraktive Neubau-Doppelhaushälfte;539000;111.58;k.A.;345;Straße nicht freigegeben;49134;Wallenhorst;;Doppelhaushälfte;;Zustand: projektiert ;nicht unterkellert ;KfW 55, Massivhaus;2021;;Terrasse 
https://www.immowelt.de/expose/254zc5j;2022-07-21 13:27:52.260731;Wohlfühlfaktor inklusive! Top moderne Doppelhaushälfte in Wallenhorst-Lechtingen;499000;111.36;k.A.;263;Straße nicht freigegeben;49134;Wallenhorst;Lechtingen;Doppelhaushälfte;;Zustand: projektiert ;nicht unterkellert ;KfW 55, Massivhaus;2021;;Terrasse 
https://www.immowelt.de/expose/26cy459;2022-07-21 13:27:52.988454;Jetzt die Chance ergreifen: EFH in Hollage mit optionaler Eigentumswohnung!;470000;270;11;992;Straße nicht freigegeben;49134;WallenhorstHollage;;Einfamilienhaus;;Zustand: gepflegt ;voll unterkellert ;;1955;B;Terrasse 
https://www.immowelt.de/expose/263cl5g;2022-07-21 13:27:53.741025;Ideal für Ihre Familie! Freistehendes Einfamilienhaus in Hollage;497000;157.40;5;656;Straße nicht freigegeben;49134;WallenhorstHollage;;Einfamilienhaus;;Zustand: renoviert / saniert ;voll unterkellert ;;1938;H;Terrasse 
https://www.immowelt.de/expose/26dcu56;2022-07-21 13:27:54.456070;Gestalten Sie sich Ihr Traumhaus für die ganze Familie neu! EFH in Hollage mit viel Potential.;450000;177.12;8;700;Straße nicht freigegeben;49134;WallenhorstHollage;;Einfamilienhaus;;Zustand: renovierungsbedürftig / sanierungsbedürftig ;voll unterkellert ;;1974;;Terrasse, Balkon 
https://www.immowelt.de/expose/25m4k5e;2022-07-21 13:27:55.183478;Interessant für Eigennutzer und Kapitalanleger! Mehrfamilienhaus in guter Wohnlage von Wallenhorst;765000;400;18;752;Straße nicht freigegeben;49134;Wallenhorst;Lechtingen;Mehrfamilienhaus;;;;Massivhaus;1995;D;
https://www.immowelt.de/expose/26v9h5g;2022-07-21 13:27:55.832860;ATTRAKTIV, RUHIG GELEGEN - FÜR KAPITALANLEGER!;1600000;567;18;636;Straße nicht freigegeben;49134;Wallenhorst;Hollage;Mehrfamilienhaus;3 ;;voll unterkellert ;;;;Garten, Balkon 
https://www.immowelt.de/expose/25yyc5j;2022-07-21 13:27:56.516351;Familientraum in Wallenhorst-Lechtingen! Durchdachte Doppelhaushälfte in wunderbarer Lage;499000;111.36;k.A.;258;Straße nicht freigegeben;49134;Wallenhorst;;Doppelhaushälfte;;Zustand: projektiert ;nicht unterkellert ;KfW 55, Massivhaus;2021;;Terrasse 
https://www.immowelt.de/expose/259w25t;2022-07-21 13:27:57.421815;gepflegtes Einfamilienhaus mit Einliegerwohnung mit Stadtbusanbindung;398000;242;9,5;1346;Straße nicht freigegeben;49134;Wallenhorst;Hollage;Einfamilienhaus;;;;;1956;;
https://www.immowelt.de/expose/25lxc5j;2022-07-21 13:27:58.109270;Happy home, happy life!  Neubau-Doppelhaushälfte in Wallenhorst-Lechtingen;519000;111.36;k.A.;321;Straße nicht freigegeben;49134;Wallenhorst;;Doppelhaushälfte;;Zustand: projektiert ;nicht unterkellert ;KfW 55, Massivhaus;2021;;Terrasse 
https://www.immowelt.de/expose/25axc5j;2022-07-21 13:27:58.821671;Moderner Wohntraum in Wallenhorst-Lechtingen!;499000;111.36;k.A.;259;Straße nicht freigegeben;49134;Wallenhorst;Lechtingen;Doppelhaushälfte;;Zustand: projektiert ;nicht unterkellert ;KfW 55, Massivhaus;2021;;Terrasse 
https://www.immowelt.de/expose/25rln5w;2022-07-21 13:27:59.772243;Kapitalanlage mit Perspektive in Wallenhorst;349000;220;8;1413;Straße nicht freigegeben;49134;Wallenhorst;Hollage;Einfamilienhaus;;Zustand: Altbau (bis 1945), gepflegt ;teilweise unterkellert ;Massivhaus;1765;C;Terrasse, Garten, Balkon 
https://www.immowelt.de/expose/25zxc5j;2022-07-21 13:28:00.478763;Mit Weitblick!  *Tolle Doppelhaushälfte mit optimalen und modernen Gegebenheiten*;539000;111.58;k.A.;339;Straße nicht freigegeben;49134;Wallenhorst;;Doppelhaushälfte;;Zustand: projektiert ;nicht unterkellert ;KfW 55, Massivhaus;2021;;Terrasse 
https://www.immowelt.de/expose/25hye5t;2022-07-21 13:28:01.199267;Luxuriös Wohnen - Effektiv Arbeiten: Gewerbeimmobilie mit Wohnimmobilie in Wallenhorst;2350000;265;9;5017;Straße nicht freigegeben;49134;Wallenhorst;Hollage;Einfamilienhaus;;;;;;;
https://www.immowelt.de/expose/26dbt55;2022-07-21 13:28:01.924024;Einfamilienhaus als Energiesparhaus in Ilsede, Top Süd Lage;649000;216;10;600;Zum Busch 27;31241;Ilsede;Klein Ilsede;Einfamilienhaus;2 ;;voll unterkellert ;;2001;B;Terrasse, Garten 
https://www.immowelt.de/expose/25vxg5f;2022-07-21 13:28:02.642395;Gemütliches Reihenhaus mit viel Platz in zentraler Lage von Bülten;188000;110.60;6;137;Straße nicht freigegeben;31241;IlsedeBülten;;Reihenmittelhaus;;Zustand: renovierungsbedürftig / sanierungsbedürftig ;voll unterkellert ;Massivhaus;1939;F;
https://www.immowelt.de/expose/24phf5z;2022-07-21 13:28:03.365904;Mehrfamilienhaus mit 4 Wohneinheiten Groß Ilsede;255000;235;12;690;Straße nicht freigegeben;31241;Ilsede;Groß Ilsede;Mehrfamilienhaus;;Zustand: Altbau (bis 1945) ;;;1890;F;Terrasse 
https://www.immowelt.de/expose/26zzx5g;2022-07-21 13:28:04.020849;Aufhebung der Gem.: Dreifamilienhaus nebst Weg und Gartenland in Ilsede;310000;294;9;601;Straße nicht freigegeben;31241;Ilsede;Klein Ilsede;Mehrfamilienhaus;2 ;;voll unterkellert ;;ca. 1900;;Balkon 
https://www.immowelt.de/expose/25nup5x;2022-07-21 13:28:04.755446;Mehrfamilienhaus mit Ladengeschäft und Fachwerk-Scheune in zentraler Lage!;395000;187;8;1151;Straße nicht freigegeben;31241;Ilsede;Groß Ilsede;Mehrfamilienhaus;;Zustand: renovierungsbedürftig / sanierungsbedürftig ;teilweise unterkellert ;Massivhaus;1954;H;
https://www.immowelt.de/expose/26dtg5g;2022-07-21 13:28:05.496153;Ein Haus mit Charme im kommenden Baugeb. in Groß Ilsede.;215010;109;5;kA  Grundstücksfl  ;Dinkelstraße ;31241;Ilsede;Groß Ilsede;Einfamilienhaus;;Zustand: Neubau ;;Massivhaus;2022;;
https://www.immowelt.de/expose/24jef5z;2022-07-21 13:28:06.213520;Einfamilienhaus mit Nebengebäude (ehem. Kirche);295000;121;4;435;Straße nicht freigegeben;31241;Ilsede;Groß Ilsede;Einfamilienhaus;;Zustand: gepflegt ;nicht unterkellert ;;2003;C;Terrasse 
