url;zeitpunkt;titel;preis;wohnflaeche;anz_zimmer;grundstueckflaeche;strasse;plz;stadt;stadtteil;kategorie;anz_stockwerke;zustand;keller;typ;baujahr;energieeffizienz;aussenbereich
https://www.immowelt.de/expose/26z9e5f;2022-07-21 13:24:37.618627;Rohrsen-energetisch attraktives Architektenhaus Bj. 2017 mit rückw. Blick über die Felder;549900;210.0;7;1500;Straße nicht freigegeben;31627;Rohrsen;;Einfamilienhaus;;;;KfW 55;2017;A;Terrasse, Garten 
https://www.immowelt.de/expose/25dnn5g;2022-07-21 13:24:38.313270;Gut gepflegtes Zweifamilienhaus auf großzügigem Grundstück in schöner und ruhiger Lage von Rohrsen;399000;340.0;7;1900;Straße nicht freigegeben;31627;Rohrsen;;Mehrfamilienhaus;;;teilweise unterkellert ;Massivhaus;1956;;
https://www.immowelt.de/expose/26bwq5g;2022-07-21 13:24:39.034442;Großzügiges Einfamilienhaus in Feldrandlage von Embsen !;365000;106.2;7;1003;Straße nicht freigegeben;21409;Embsen;;Einfamilienhaus;;;;;1963;;
https://www.immowelt.de/expose/25wdc5q;2022-07-21 13:24:39.752148;Wohnen auf einer Ebene in Embsen!;499900;225.0;6;1150;Straße nicht freigegeben;21409;Embsen;;Einfamilienhaus;;;;;1983;C;Terrasse 
https://www.immowelt.de/expose/264qp58;2022-07-21 13:24:40.547128;Hochwertiger Bungalow mit Einliegerwohnung in Sackgassenlage! *Photovoltaik*Solarthermie*;549000;196.0;6;959;Straße nicht freigegeben;21409;Embsen;;Bungalow;;Zustand: gepflegt ;nicht unterkellert ;;1996;;Terrasse 
https://www.immowelt.de/expose/26r3556;2022-07-21 13:24:41.344891;PROVISIONSFREI für Käufer -  Zwei Wohneinheiten unter einem Dach;899000;266.67;9;933;Straße nicht freigegeben;21409;Embsen;;Einfamilienhaus;;;;Massivhaus;2017;B;
https://www.immowelt.de/expose/26wah5g;2022-07-21 13:24:42.188909;Traumlage - Einfamilien-Haus in Bienenbüttel in ruhiger Sackgasse;398000;100.0;4;kA  Grundstücksfl  ;Straße nicht freigegeben;29553;Bienenbüttel;;Einfamilienhaus;;;;;1977;;
