url;zeitpunkt;titel;preis;wohnflaeche;anz_zimmer;grundstueckflaeche;strasse;plz;stadt;stadtteil;kategorie;anz_stockwerke;zustand;keller;typ;baujahr;energieeffizienz;aussenbereich
https://www.immowelt.de/expose/25pjl5r;2022-07-20 12:02:35.777844;2 schöne vermietete Doppelhaushälften in Heidenau;549000;205.0;8;1113;Straße nicht freigegeben;21258;Heidenau;;Doppelhaushälfte;;Zustand: renoviert ;nicht unterkellert ;;2003.0;;Terrasse, Garten 
https://www.immowelt.de/expose/259s35u;2022-07-20 12:02:36.376375;Großzügiger Bungalow, idyllisch am Rande  von Heidenau gelegen!;625000;140.0;3;1165;Straße nicht freigegeben;21258;Heidenau;;Bungalow;;Zustand: gepflegt ;;;2021.0;;
https://www.immowelt.de/expose/2682y5c;2022-07-20 12:02:36.986191;Naturnah wohnen an der Fischbeker Heide;398500;88.97;4,5;402;Straße nicht freigegeben;21629;NeuWulmstorf;;Reihenendhaus;;Zustand: gepflegt ;voll unterkellert ;Massivhaus;1969.0;H;Terrasse, Garten 
https://www.immowelt.de/expose/25bp25k;2022-07-20 12:02:37.609508;Verkaufsangebot für ein 4 Zimmer Endreihenhaus, Neu Wulmstorf, top Lage im Dichterviertel, ca. 105,91 m² Wohnfläche, auf ca. 339 m² Eigenland;439000;105.91;4;339;Goethestraße;21629;NeuWulmstorf;;Reihenendhaus;2 ;Zustand: gepflegt ;voll unterkellert, Dach ausgebaut ;;1968.0;;Terrasse, Garten, Balkon 
https://www.immowelt.de/expose/2683x5c;2022-07-20 12:02:38.142683;Doppelhaushälfte in 21629 Neu Wulmstorf, Dünenkamp;300000;91.0;k.A.;321;Straße nicht freigegeben;21629;NeuWulmstorf;;;;;voll unterkellert ;;1955.0;;
https://www.immowelt.de/expose/26ww653;2022-07-20 12:02:38.834696;Verkaufsangebot für ein top renoviertes Mittelreihenhaus mit 5 Zimmern, ca. 89 m² Wohnfläche auf ca. 194 m² Eigenland in 21629 Neu Wulmstorf;359000;89.0;5;194;Straße nicht freigegeben;21629;NeuWulmstorf;;Reihenmittelhaus;2 ;;voll unterkellert, Dach ausgebaut ;;2007.0;F;Terrasse, Garten 
https://www.immowelt.de/expose/268dk59;2022-07-20 12:02:39.478422;Märchenhaft Verwandlung auf 800m²;675000;177.0;6;800;Straße nicht freigegeben;21629;Elstorf;;Einfamilienhaus;;;voll unterkellert ;;;;Garten, Balkon 
https://www.immowelt.de/expose/26qbf52;2022-07-20 12:02:40.064092;Aufhebung der Gem.: Doppelhaushälfte in Neu Wulmstorf;300000;91.0;k.A.;321;Straße nicht freigegeben;21629;NeuWulmstorf;;Doppelhaushälfte;1 Geschoss;;teilweise unterkellert, Dach ausgebaut ;;1955.0;;
https://www.immowelt.de/expose/25adg5v;2022-07-20 12:02:40.608191;Provisionsfrei - Ein Reihenendhaus mit viel Platz und Charisma!;449000;109.0;4;360;Straße nicht freigegeben;21629;NeuWulmstorf;;Reihenendhaus;2 ;Zustand: renoviert ;nicht unterkellert ;;1991.0;;Terrasse, Garten 
https://www.immowelt.de/expose/26hge5e;2022-07-20 12:02:41.220635;Von Privat- Mittelreihenhaus 5 +1- Zi -116 m² Wohnfläche + 70 m² Keller;425000;116.0;5;120;Straße nicht freigegeben;21629;NeuWulmstorf;;Reihenmittelhaus;;Zustand: gepflegt ;voll unterkellert ;;1965.0;;Terrasse, Garten, Balkon 
https://www.immowelt.de/expose/26wrj58;2022-07-20 12:02:41.845176;sehr gepflegte 4-Zimmer-Doppelhaushälfte mit Garage und Carport;460000;110.0;4;344;Straße nicht freigegeben;21629;NeuWulmstorf;;Doppelhaushälfte;1 Geschoss;Zustand: gepflegt ;;Massivhaus;1985.0;E;Terrasse, Garten 
https://www.immowelt.de/expose/25tyn5m;2022-07-20 12:02:42.441905;Gepflegtes Reihenhaus an der Fischbeker Heide für die ganze Familie!;369000;92.0;4,5;127;Straße nicht freigegeben;21629;NeuWulmstorf;;Reihenmittelhaus;3 ;Zustand: renoviert ;voll unterkellert ;;1961.0;F;Terrasse, Garten, Gartenanteil 
https://www.immowelt.de/expose/24k9h5u;2022-07-20 12:02:43.115910;Verkaufsangebot für ein 4 Zimmer Mittelreihenhaus, sehr gepflegt, ca. 89 m² Wohnfläche, 149 m² eigenes Grundstück in Neu Wulmstorf;342000;89.0;4;149;Gumbinner Straße 28;21629;NeuWulmstorf;;Reihenmittelhaus;;Zustand: gepflegt ;voll unterkellert, Dach ausgebaut ;;1962.0;;Terrasse, Garten 
https://www.immowelt.de/expose/26gm35g;2022-07-20 12:02:43.673440;Zwangsversteigerung Haus, Dünenkamp in Neu Wulmstorf;300000;91.0;5;321;Straße nicht freigegeben;21629;NeuWulmstorf;;Doppelhaushälfte;;;;;;;
https://www.immowelt.de/expose/2656252;2022-07-20 12:02:44.231313;Einfamilienhaus in 21629 Neu Wulmstorf;300000;91.0;k.A.;kA  Grundstücksfl  ;Straße nicht freigegeben;21629;NeuWulmstorf;;;;;;;;;
https://www.immowelt.de/expose/26zt553;2022-07-20 12:02:44.868188;Gepflegter 4-Zimmer-Wohntraum mit herrlicher Gartenoase vor den Toren Hamburgs;450000;103.0;4;500;Straße nicht freigegeben;21629;NeuWulmstorf;;Doppelhaushälfte;;Zustand: gepflegt ;nicht unterkellert ;;1999.0;B;
https://www.immowelt.de/expose/26eer52;2022-07-20 12:02:45.695641;Verkaufsangebot für ein tippiditoppi Reihenmittelhaus mit 5 Zimmern, Vollkeller mit Außenzugang, Dichterviertel, ruhige Lage in 21629 Neu Wulmstorf;395000;85.06;5;115;Goethestraße 6;21629;NeuWulmstorf;;Reihenmittelhaus;;;voll unterkellert, Dach ausgebaut ;;1989.0;H;Terrasse, Garten 
https://www.immowelt.de/expose/268t556;2022-07-20 12:02:46.433680;Gepflegtes Reihenmittelhaus in schöner Wohngegend;465000;107.17;4;121;Straße nicht freigegeben;21629;NeuWulmstorf;;Reihenmittelhaus;2 ;Zustand: gepflegt ;voll unterkellert ;;1990.0;A;Terrasse 
https://www.immowelt.de/expose/26ld957;2022-07-20 12:02:47.128731;4-Zimmer-Einfamilienhaus mit Vollkeller, 2 Bädern und Do-Carport;619800;112.0;4;660;Hasenbuschfeld 3;21629;NeuWulmstorf;Elstorf;Einfamilienhaus;;Zustand: gepflegt ;voll unterkellert ;;2000.0;B;Terrasse, Garten, Balkon 
https://www.immowelt.de/expose/26bp65c;2022-07-20 12:02:47.688468;Gepflegtes Einfamilienhaus in ruhiger und zentraler Lage in Neu Wulmstorf;685000;115.0;4;360;Straße nicht freigegeben;21629;Hamburg;Neu Wulmstorf;Einfamilienhaus;;;;;1990.0;;Terrasse, Garten 
https://www.immowelt.de/expose/26wfy53;2022-07-20 12:02:48.298690;Gepflegtes EFH mit zwei Wohneinheiten und sehr ansprechender Fassade in Neu Wulmstorf;850000;199.0;7;520;Straße nicht freigegeben;21629;NeuWulmstorf;;Einfamilienhaus;;Zustand: gepflegt ;nicht unterkellert ;;2008.0;D;Terrasse, Garten, Balkon 
https://www.immowelt.de/expose/26a7h5d;2022-07-20 12:02:49.012225;Provisionsfrei aus Eigenbestand! Blick in die Natur!  ca. 138 qm Wohn+Nutzfläche;359000;92.0;5;184.44;Hindenburger Strasse 83;21629;NeuWulmstorfNiederelbe;;;;;;Massivhaus;1963.0;;Terrasse 
https://www.immowelt.de/expose/25gc85p;2022-07-20 12:02:49.627234;Traumhafte Doppelhaushälfte mit Garten zum Einziehen und Wohlfühlen;595000;141.0;4;400;Straße nicht freigegeben;21629;Ohlenbüttel;;Doppelhaushälfte;;;nicht unterkellert ;;2001.0;B;
https://www.immowelt.de/expose/25fwu5w;2022-07-20 12:02:50.236108;Einfamilienhaus mit viel Platz und extra Baugrundstück von ca. 700 m²;625000;157.0;6;1490;Straße nicht freigegeben;21629;NeuWulmstorf;Elstorf;Einfamilienhaus;;Zustand: renoviert ;;;;;
https://www.immowelt.de/expose/26f7x5a;2022-07-20 12:02:50.837859;Kaminofen inklusive!;379000;88.69;4;174;Straße nicht freigegeben;21629;NeuWulmstorf;;Reihenmittelhaus;;Zustand: gepflegt ;voll unterkellert ;Massivhaus;1967.0;G;Terrasse, Garten 
https://www.immowelt.de/expose/26m6856;2022-07-20 12:02:51.457572;Kaufpreis reduziert: Doppelhaushälfte direkt im Apfelgarten, jetzt provisionsfrei!;675000;145.0;5;350;Straße nicht freigegeben;21629;NeuWulmsdorf;Neu Wulmstorf;Doppelhaushälfte;;Zustand: Erstbezug ;;;;D;
https://www.immowelt.de/expose/2534w5t;2022-07-20 12:02:52.108989;großzügiges 3-4-Raum-Endreihenhaus mit Vollkeller und Carport;525000;91.0;3;164;Straße nicht freigegeben;21629;NeuWulmstorf;;Reihenendhaus;1 Geschoss;Zustand: gepflegt ;voll unterkellert, Dach ausgebaut ;;2003.0;D;Terrasse, Garten 
https://www.immowelt.de/expose/24mzv5y;2022-07-20 12:02:52.733177;30 km südlich von HH: Großes Einfamilienhaus inkl. ELW, gehobene Ausstattung, sehr gute Wohnlage;800000;239.14;10;1496;Straße nicht freigegeben;21629;NeuWulmstorf;Elstorf;Einfamilienhaus;;;voll unterkellert ;Massivhaus;2007.0;F;Terrasse, Garten 
https://www.immowelt.de/expose/2za384a;2022-07-20 12:02:53.327869;Glücklich wohnen im eigenen Einfamilienhaus!;272400;123.75;4;1;Straße nicht freigegeben;21629;NeuWulmstorf;;Einfamilienhaus;;;;;;;
https://www.immowelt.de/expose/254dq5w;2022-07-20 12:02:53.932070;Gemütliches Eigenheim mit Garten, Balkon inkl. Sauna am Hamburger Stadtrand;385000;103.0;5;175;Straße nicht freigegeben;21629;NeuWulmstorf;;Reihenmittelhaus;;Zustand: gepflegt ;voll unterkellert ;;1968.0;F;Terrasse, Garten, Balkon 
https://www.immowelt.de/expose/25nsb5p;2022-07-20 12:02:54.547545;Gemütlichstes Wohnglück nahe der Fischbeker Heide;362000;83.0;4;134;Straße nicht freigegeben;21629;NeuWulmstorf;;Reihenmittelhaus;;;voll unterkellert ;Massivhaus;1961.0;F;Terrasse, Garten 
https://www.immowelt.de/expose/26aye5a;2022-07-20 12:02:55.167890;Gestalten, verwirklichen, Renovieren - Zweifamilienhaus mit vielen Möglichkeiten!;679000;235.0;8;697;Straße nicht freigegeben;21629;NeuWulmstorfNiederelbe;;Mehrfamilienhaus;;Zustand: Neubau, renovierungsbedürftig ;teilweise unterkellert ;Massivhaus;85.0;;Terrasse, Garten, Gartenanteil, Balkon 
https://www.immowelt.de/expose/25cj95t;2022-07-20 12:02:55.765000;Vielseitiger Bungalow in ruhiger Lage in Neu Wulmstorf;599000;125.0;4;677;Straße nicht freigegeben;21629;NeuWulmstorf;;Bungalow;;Zustand: renovierungsbedürftig ;;;;F;
https://www.immowelt.de/expose/232a35g;2022-07-20 12:02:56.351064;tolles Neubauprojekt in Neu Wulmstorf - 2 moderne Doppelhäuser in guter Lage;524600;96.91;4;266;Straße nicht freigegeben;21629;NeuWulmstorf;;Mehrfamilienhaus;;Zustand: Neubau ;;KfW 55, Massivhaus;2022.0;;
https://www.immowelt.de/expose/25v2g5p;2022-07-20 12:02:57.066971;Bezugsfertiges Einfamilienhaus in familienfreundlicher Lage von Neu Wulmstorf - Elstorf!;685000;170.0;7;920;Straße nicht freigegeben;21629;NeuWulmstorf;Elstorf;Einfamilienhaus;;Zustand: gepflegt ;teilweise unterkellert ;;1994.0;;Terrasse 
https://www.immowelt.de/expose/257wu5w;2022-07-20 12:02:57.678325;Liebevolles Zuhause sucht neuen Eigentümer;429000;96.59;4;227.57;Straße nicht freigegeben;21629;NeuWulmstorf;;Reihenmittelhaus;;Zustand: gepflegt ;voll unterkellert ;Massivhaus;1983.0;E;Terrasse 
https://www.immowelt.de/expose/24tkn5w;2022-07-20 12:02:58.287980;Märchenhafte Verwandlung auf 1613m²;950000;177.0;6;1613;Straße nicht freigegeben;21629;Elstorf;;Einfamilienhaus;;;voll unterkellert ;;;;Garten, Balkon 
https://www.immowelt.de/expose/25tbe5z;2022-07-20 12:02:59.000869;3-2/2-Zimmer-Bungalow mit Vollkeller in Sackgassenlage;440000;126.0;5;969;Tannenweg 5;21629;NeuWulmstorf;Elstorf;Bungalow;;Zustand: renovierungsbedürftig ;voll unterkellert ;;1973.0;C;Terrasse, Garten 
https://www.immowelt.de/expose/25k3l5m;2022-07-20 12:02:59.640350;**possiel makes it possible** Hereinspaziert! Bungalow in gefragter Lage!;350000;111.0;3;991;Straße nicht freigegeben;38448;WolfsburgWendschott;;Einfamilienhaus;;Zustand: gepflegt ;voll unterkellert ;Fertighaus;1974.0;;Terrasse, Garten 
https://www.immowelt.de/expose/2677557;2022-07-20 12:03:00.193989;Junges Reihemittelhaus mit Garten & Stellplatz in Vorsfelde;416100;133.0;4;582;Straße nicht freigegeben;38448;Wolfsburg;Tiergartenbreite;Reihenmittelhaus;;;teilweise unterkellert ;Massivhaus;2004.0;;Terrasse, Garten 
https://www.immowelt.de/expose/268jk53;2022-07-20 12:03:00.844094;**possiel makes it possible** Sehr gepflegte Immobilie für die große Familie, Mehrgenerationswohnen!;545000;199.0;8;1059;Neisser Straße 11;38448;WolfsburgWendschott;;Mehrfamilienhaus;;Zustand: gepflegt ;voll unterkellert ;Massivhaus;1964.0;F;Terrasse, Garten 
https://www.immowelt.de/expose/25fbv5t;2022-07-20 12:03:01.466516;+ + wohnen auf einer Ebene/Vorsfelde + +;335000;107.68;5;331;Straße nicht freigegeben;38448;Wolfsburg;Vorsfelde;Reihenmittelhaus;;;;;1963.0;H;
https://www.immowelt.de/expose/25zlr5x;2022-07-20 12:03:02.109374;**possiel makes it possible** SANIERTES Zweifamilienhaus in Vorsfelde Süd + Baugrundstück;495000;210.0;6;609;Straße nicht freigegeben;38448;WolfsburgVorsfelde;;Mehrfamilienhaus;;Zustand: renoviert ;voll unterkellert ;Massivhaus;1957.0;F;Terrasse, Garten 
https://www.immowelt.de/expose/26x7l5c;2022-07-20 12:03:02.730824;Wohlfühlwohnen in Vorsfelde;419000;100.13;4;518;Straße nicht freigegeben;38448;WolfsburgVorsfelde;;Doppelhaushälfte;;Zustand: gepflegt ;;Massivhaus;2005.0;C;
https://www.immowelt.de/expose/25cad5p;2022-07-20 12:03:03.329077;Viel Platz zum Wohlfühlen - Einfamilienhaus mit Einliegerwohnung in Wendschott;650000;265.0;8;695;Straße nicht freigegeben;38448;Wolfsburg;Wendschott;Mehrfamilienhaus;;Zustand: gepflegt ;voll unterkellert ;;1976.0;D;
https://www.immowelt.de/expose/268lj5c;2022-07-20 12:03:03.872279;Reihenmittelhaus in 38448 Wolfsburg, Krummacker;416100;133.0;k.A.;582;Straße nicht freigegeben;38448;Wolfsburg;Vorsfelde;;;;voll unterkellert ;;2004.0;;
https://www.immowelt.de/expose/25pu258;2022-07-20 12:03:04.674185;Ein Haus mit vielen Facetten!;635000;234.0;7;1689;Straße nicht freigegeben;38448;Wolfsburg;Kästorf;Mehrfamilienhaus;;Zustand: gepflegt ;;Massivhaus;1960.0;F;
https://www.immowelt.de/expose/24cbp5h;2022-07-20 12:03:05.242816;***AKTION*** Ausbauhaus, ideal für junge Familien;339000;154.0;5;kA  Grundstücksfl  ;Straße nicht freigegeben;38448;Wolfsburg;Brackstedt;Einfamilienhaus;2 ;Zustand: Neubau ;;Massivhaus;2022.0;;
https://www.immowelt.de/expose/24u9q5z;2022-07-20 12:03:05.813577;Investor gesucht: MFH in Bestlage von Vorsfelde;290000;315.0;k.A.;300;Straße nicht freigegeben;38448;WolfsburgVorsfelde;;Mehrfamilienhaus;;Zustand: renovierungsbedürftig ;;;1860.0;;Terrasse 
https://www.immowelt.de/expose/24ceh5n;2022-07-20 12:03:06.479231;Wolfsburg - TOP-Bungalow verklinkert -WFL ca. 137 m² & 27,7 m² Garage - inkl. 83 m² Ausbaureserve;549000;137.0;4;628;Sattlerring;38448;Wolfsburg;Brackstedt;Bungalow;;Zustand: gepflegt ;;KfW 55, Massivhaus;2014.0;A;Terrasse, Garten 
https://www.immowelt.de/expose/25gs75k;2022-07-20 12:03:07.144144;**possiel makes it possible** Sehr gepflegte Immobilie für die große Familie, Mehrgenerationswohnen!;545000;199.0;8;1059;Neisser Straße 11;38448;WolfsburgWendschott;;Einfamilienhaus;;Zustand: gepflegt ;voll unterkellert ;Massivhaus;1964.0;F;Terrasse, Garten 
https://www.immowelt.de/expose/25hfj5t;2022-07-20 12:03:07.727423;Lichtdurchfluteter Bungalow in guter Infrastruktur!;495000;122.0;5;569;Straße nicht freigegeben;38448;WolfsburgWendschott;;Bungalow;;Zustand: gepflegt ;nicht unterkellert ;;2009.0;A;
https://www.immowelt.de/expose/258lk5k;2022-07-20 12:03:08.623116;Moderner Wohntraum in Wendschott;948000;225.0;5;860;Straße nicht freigegeben;38448;WolfsburgWendschott;;Einfamilienhaus;;;nicht unterkellert ;;2016.0;B;Terrasse, Garten 
https://www.immowelt.de/expose/26s8z58;2022-07-20 12:03:09.248322;***Sehr schönes Einfamilienwohnhaus mit Doppelgarage, Vollkeller und Balkon in einwandfreier Lage***;398000;136.0;6;1047;Straße nicht freigegeben;38448;Wolfsburg;Velstove;Einfamilienhaus;;Zustand: gepflegt ;voll unterkellert ;;1999.0;F;Terrasse, Balkon 
https://www.immowelt.de/expose/268u35g;2022-07-20 12:03:09.794040;Zwangsversteigerung Haus, Krummacker in Wolfsburg;416100;133.0;4;kA  Grundstücksfl  ;Straße nicht freigegeben;38448;Wolfsburg;Vorsfelde;Reihenmittelhaus;;;;;;;
https://www.immowelt.de/expose/25ej45h;2022-07-20 12:03:10.405852;Attraktives Investment in der Wolfsburger Nordstadt;425000;236.0;9;550;Straße nicht freigegeben;38448;Wolfsburg;Tiergartenbreite;Mehrfamilienhaus;;Zustand: renovierungsbedürftig ;voll unterkellert ;;1958.0;;Terrasse, Balkon 
https://www.immowelt.de/expose/25f665u;2022-07-20 12:03:11.043991;Kleines Haus in Traumlage;388000;120.0;5;565;Straße nicht freigegeben;38448;Wolfsburg;Wendschott;Einfamilienhaus;;;;Massivhaus;1960.0;F;
https://www.immowelt.de/expose/264le57;2022-07-20 12:03:11.598030;Einfamilienhaus in 38448 Wolfsburg;416100;133.0;k.A.;kA  Grundstücksfl  ;Straße nicht freigegeben;38448;Wolfsburg;Vorsfelde;;;;;;;;
https://www.immowelt.de/expose/25brq5u;2022-07-20 12:03:12.315843;Gepflegtes Anlageobjekt vor den Toren Friesoythe´s!;278000;140.0;6;567.50;Straße nicht freigegeben;26169;Friesoythe;Ellerbrock;Mehrfamilienhaus;;;nicht unterkellert ;;2001.0;;
https://www.immowelt.de/expose/24knc5p;2022-07-20 12:03:12.961402;First Class. Nobel, elegant mit hinreißendem Charme!!;995000;446.0;7;1322;Straße nicht freigegeben;26169;Friesoythe;;Villa;;;;;2016.0;;
https://www.immowelt.de/expose/268jg5a;2022-07-20 12:03:13.607258;Großzügiges, repräsentatives Eigenheim auf Erbpacht;363000;250.0;7;1018;Straße nicht freigegeben;26169;Friesoythe;Neuvrees;Einfamilienhaus;;Zustand: gepflegt ;;Massivhaus;1992.0;C;Terrasse 
https://www.immowelt.de/expose/26z4n56;2022-07-20 12:03:14.206659;Renovierungsbedürftige Immobilie in Friesoythe;198000;117.0;3;1367;Straße nicht freigegeben;26169;Friesoythe;;Einfamilienhaus;;Zustand: renovierungsbedürftig ;;;1990.0;H;
https://www.immowelt.de/expose/252e65x;2022-07-20 12:03:14.817216;Keine Käuferprovision! Modernes Wohnen in der Nähe der lebensfrohen Gemeinde Edewecht, der ältesten Ortschaft des Ammerlandes;339000;101.0;4;327;Straße nicht freigegeben;26169;FriesoytheEdewechterdamm;;Doppelhaushälfte;;Zustand: Erstbezug ;;;2022.0;A+;Terrasse 
https://www.immowelt.de/expose/257gs5z;2022-07-20 12:03:15.515046;Ruhig und gelassen leben - Top saniertes Einfamilienhaus in 2. Reihe am Fehnkanal!;339000;132.35;3;1578;Straße nicht freigegeben;26169;Friesoythe;Kampe;Einfamilienhaus;;Zustand: renoviert ;;;2013.0;E;Terrasse 
https://www.immowelt.de/expose/25mgj5t;2022-07-20 12:03:16.092987;Sanierungsbedürftiges Einfamilienhaus mit gr. Grundstück in ruhiger Alleinlage in Friesoythe/ LK Cloppenburg;195000;120.0;6;4025;Straße nicht freigegeben;26169;Friesoythe;;Einfamilienhaus;;Zustand: Altbau (bis 1945) ;;;1938.0;;
https://www.immowelt.de/expose/266875e;2022-07-20 12:03:16.673346;RESERVIERT! Familienfreundliches Wohnen in schöner Lage;245000;114.89;5;350;Straße nicht freigegeben;26169;Friesoythe;;Doppelhaushälfte;;Zustand: gepflegt ;;Massivhaus;1999.0;;Terrasse 
https://www.immowelt.de/expose/25je65x;2022-07-20 12:03:17.290747;Keine Käuferprovision! Modernes Wohnen in der Nähe der lebensfrohen Gemeinde Edewecht, der ältesten Ortschaft des Ammerlandes;337000;101.0;4;287;Straße nicht freigegeben;26169;FriesoytheEdewechterdamm;;Doppelhaushälfte;;Zustand: Erstbezug ;;;2022.0;A+;Terrasse 
https://www.immowelt.de/expose/25v455x;2022-07-20 12:03:17.861585;**Keine Käuferprovision** 4ZKB Neubau Doppelhaushälfte direkt in Friesoythe!;379000;103.14;4;369;Straße nicht freigegeben;26169;Friesoythe;;Doppelhaushälfte;;;nicht unterkellert ;;2022.0;;
https://www.immowelt.de/expose/26r8g5a;2022-07-20 12:03:18.445813;Top-Zustand! Eigenheim mit Charme;395000;146.0;5;1506;Straße nicht freigegeben;26169;Friesoythe;Ellerbrock;Einfamilienhaus;;;;Massivhaus;2015.0;;Terrasse 
https://www.immowelt.de/expose/2663q5c;2022-07-20 12:03:19.118009;Friesoythe-Neulorup: Mobilheim, Dauerwohnsitz, renoviert 2021, Carport, Obj. 6220;79900;42.0;3;200;Straße nicht freigegeben;26169;FriesoytheGehlenberg;;Bungalow;;Zustand: renoviert ;;;2008.0;;Terrasse, Garten 
https://www.immowelt.de/expose/25a555x;2022-07-20 12:03:19.696858;**Keine Käuferprovision** 4ZKB Neubau Doppelhaushälfte direkt in Friesoythe!;379000;110.14;4;415;Straße nicht freigegeben;26169;Friesoythe;;Doppelhaushälfte;;;nicht unterkellert ;;2022.0;;
https://www.immowelt.de/expose/25zqp56;2022-07-20 12:03:20.459504;Schatz, das wird unser Schloss!!;669000;355.0;7;2243;Straße nicht freigegeben;26169;Friesoythe;Neuvrees;Villa;;Zustand: gepflegt ;nicht unterkellert ;;2001.0;;
https://www.immowelt.de/expose/2652c5f;2022-07-20 12:03:20.988780;NEUBAU EFH IN DER NATUR AM KÜSTENKANAL;349000;140.0;4;750;Straße nicht freigegeben;26169;Friesoythe;Ahrensdorf;Einfamilienhaus;;;;;;;Terrasse, Garten 
https://www.immowelt.de/expose/2624y5c;2022-07-20 12:03:21.623811;Friesoythe-Neulorup: Dauerwohnsitz Mobilheim, renoviert 2021, Carport, Obj. 6220;79900;42.0;3;200;Straße nicht freigegeben;26169;FriesoytheGehlenberg;;;;Zustand: renoviert ;;;2008.0;;Terrasse, Garten 
https://www.immowelt.de/expose/24cjh57;2022-07-20 12:03:22.252853;Sie suchen ein Zuhause für 1 oder 2 Generationen? Hier ist genau das richtige für Sie!!;479000;235.0;6;530;Straße nicht freigegeben;26169;Friesoythe;;Mehrfamilienhaus;;Zustand: gepflegt ;nicht unterkellert ;;2016.0;;
https://www.immowelt.de/expose/26wmf58;2022-07-20 12:03:22.832014;Landhaus mit Kapitänsgiebel in Gehlenberg;377700;131.0;5;705;Straße nicht freigegeben;26169;Friesoythe;;Einfamilienhaus;;Zustand: Neubau ;;KfW 70;2022.0;;
https://www.immowelt.de/expose/25b5r5u;2022-07-20 12:03:23.423551;Nutzen Sie es, wie Sie wollen! Haus mit 2 WE in einem Ortsteil von Friesoythe zu verkaufen!;349000;175.0;7;852;Straße nicht freigegeben;26169;Friesoythe;Ellerbrock;Mehrfamilienhaus;;;nicht unterkellert ;;2000.0;;
https://www.immowelt.de/expose/25zvh5w;2022-07-20 12:03:24.016483;Einfamilienhaus in Edewechter-Damm mit großem Grundstück sucht neuen Eigentümer.;200000;152.0;7;908;Straße nicht freigegeben;26169;Friesyothe;Friesoythe;Einfamilienhaus;;Zustand: renovierungsbedürftig ;teilweise unterkellert ;;1970.0;;
https://www.immowelt.de/expose/23l235t;2022-07-20 12:03:24.586982;Schnörkellos und gut durchdacht, Funktionalität trifft Moderne;415900;162.0;5;585;Straße nicht freigegeben;26169;Markhausen;;Einfamilienhaus;;;;KfW 55;2022.0;;
https://www.immowelt.de/expose/25amx5l;2022-07-20 12:03:25.197532;Neugebautes Ferienhaus (KfW 40) in Wasser Nähe und idyllischer Lage zum Erstbezug für Sie bereit!;299000;86.0;3;392;Straße nicht freigegeben;26169;Friesoythe;;Einfamilienhaus;1 Geschoss;Zustand: Erstbezug, Neubau ;nicht unterkellert ;KfW 40, Massivhaus;2021.0;A+;Terrasse, Garten 
https://www.immowelt.de/expose/256sk5d;2022-07-20 12:03:25.729304;Einfamilienhaus in 26169 Friesoythe;73764;250.0;k.A.;kA  Grundstücksfl  ;Straße nicht freigegeben;26169;Friesoythe;Kampe;;;;;;;;
https://www.immowelt.de/expose/2558m5x;2022-07-20 12:03:26.328498;Ist das Ihr Traumhaus?  Gepflegtes Wohnhaus mit Garage in Friesoythe-Edewechterdamm;319000;125.0;4;617;Straße nicht freigegeben;26169;Friesoythe;Edewechterdamm;Einfamilienhaus;;Zustand: gepflegt ;nicht unterkellert ;;1995.0;D;Terrasse 
https://www.immowelt.de/expose/25xrp53;2022-07-20 12:03:27.123279;Erstbezug! TOP-ausgestattetes Ferienhaus in Friesoythe!;299999;85.0;3;413;Straße nicht freigegeben;26169;Friesoythe;Schwaneburgermoor;Bungalow;;Zustand: Erstbezug ;;;2021.0;A+;Terrasse 
https://www.immowelt.de/expose/25mtb5j;2022-07-20 12:03:27.830138;Neubauprojekt - Mehrfamilienhaus mit 6 Wohnungen;1852600;470.79;17;1229;Straße nicht freigegeben;26169;Friesoythe;;Mehrfamilienhaus;;Zustand: Erstbezug ;;Massivhaus;2023.0;;
https://www.immowelt.de/expose/25l9k5w;2022-07-20 12:03:28.459940;Exklusive Immobilie m. 2 Garage u. Carport in reizvoller Lage in der Stadt Friesoythe;555000;230.0;9;811;Straße nicht freigegeben;26169;Friesoythe;;Einfamilienhaus;;;voll unterkellert ;Massivhaus;1975.0;C;Terrasse, Balkon 
https://www.immowelt.de/expose/258we5f;2022-07-20 12:03:29.028419;Exklusives Architektenhaus;785000;290.0;10;1500;Straße nicht freigegeben;26169;Friesoythe;Mehrenkamp;Einfamilienhaus;2 ;Zustand: gepflegt ;nicht unterkellert, Dach ausgebaut ;Massivhaus;2000.0;;Terrasse, Garten, Wintergarten 
https://www.immowelt.de/expose/25dct5d;2022-07-20 12:03:29.700427;FRIESOYTHE: Gepflegter KfW 70 Bungalow in zentraler Lage , Obj. 6099;429000;125.0;4;740;Straße nicht freigegeben;26169;Friesoythe;;;;Zustand: gepflegt ;nicht unterkellert ;Massivhaus;2012.0;D;Terrasse 
https://www.immowelt.de/expose/24b9x5v;2022-07-20 12:03:30.310593;Schnörkellos und gut durchdacht, Funktionalität trifft Moderne;415900;162.0;5;585;Straße nicht freigegeben;26169;Markhausen;;Einfamilienhaus;;;;KfW 55;2022.0;;
https://www.immowelt.de/expose/25dzm5w;2022-07-20 12:03:43.434620;Junger Bungalow in Hodenhagen;469000;154.0;4,5;599;Straße nicht freigegeben;29693;Hodenhagen;;Einfamilienhaus;;Zustand: gepflegt ;;;2017.0;D;
https://www.immowelt.de/expose/25f5d5y;2022-07-20 12:03:44.042786;Einfamilienhaus mit parkähnlichem Grundstück;595000;225.0;3;3950;Straße nicht freigegeben;29693;Hodenhagen;;Einfamilienhaus;;;nicht unterkellert ;Massivhaus;1998.0;D;Terrasse 
https://www.immowelt.de/expose/26m4854;2022-07-20 12:03:44.689689;Neues Ferienhaus in traumhafter Umgebung - Erstwohnsitz mit Solarthermie;149000;70.0;3;230;Straße nicht freigegeben;29693;Böhme;Kirchwahlingen;;;;;;;;
https://www.immowelt.de/expose/25k7w58;2022-07-20 12:03:45.293449;"Das ""Zollhaus"" an der Alten Leine";265000;164.0;6;2419;Straße nicht freigegeben;29693;Ahlden;Aller;Mehrfamilienhaus;;Zustand: renovierungsbedürftig ;;;1650.0;;
