url;zeitpunkt;titel;preis;wohnflaeche;anz_zimmer;grundstueckflaeche;strasse;plz;stadt;stadtteil;kategorie;anz_stockwerke;zustand;keller;typ;baujahr;energieeffizienz;aussenbereich
https://www.immowelt.de/expose/26cus5g;2022-07-24 14:24:48.621107;Architektonisches Highlight: Liebevoll saniertes Einfamilienhaus in Braunschweig-Hondelage;649000;258.0;7;600;Straße nicht freigegeben;38108;Braunschweig;Hondelage;Einfamilienhaus;;Zustand: gepflegt ;;Massivhaus;1917;A+;Terrasse, Garten 
https://www.immowelt.de/expose/2544b5j;2022-07-24 14:24:49.289662;Großzügiges Einfamilienhaus mit Einliegerwohnung und Praxisräumen in beliebter Lage;890000;360.0;10;711;Straße nicht freigegeben;38108;BraunschweigQuerum;;Einfamilienhaus;;;voll unterkellert ;Massivhaus;1976;D;Terrasse 
https://www.immowelt.de/expose/25glm5n;2022-07-24 14:24:49.931679;Hochwertige Stadtvilla in Top-Lage von Braunschweig;1985000;278.16;8;843;Straße nicht freigegeben;38108;Braunschweig;Querum;Stadthaus;;;nicht unterkellert ;;2019;C;Terrasse, Balkon 
https://www.immowelt.de/expose/26g5s5h;2022-07-24 14:24:50.607154;Doppelhaushälfte auf Erbpachtgrundstück mit Garten, Terrasse und Garagenstellplätzen;319000;107.26;4;362;Straße nicht freigegeben;38108;Braunschweig;Kralenriede;Doppelhaushälfte;;;voll unterkellert ;;1991;D;Terrasse, Garten, Balkon 
https://www.immowelt.de/expose/262y353;2022-07-24 14:24:51.344830;Exklusive Lage für Ihr Wohnvergnügen;690000;127.0;5;853;Straße nicht freigegeben;38108;Braunschweig;Querum;Mehrfamilienhaus;;;;Massivhaus;1961;H;
https://www.immowelt.de/expose/25jkg5b;2022-07-24 14:24:52.551593;Exklusive, großzügige Doppelhaushälfte mit Einfamilienhaus-Charakter auf Traumgrundstück!;1200000;238.0;6;1000;Straße nicht freigegeben;38108;BraunschweigQuerum;;Doppelhaushälfte;;Zustand: renoviert / saniert ;voll unterkellert ;;1976;E;
https://www.immowelt.de/expose/26lhl56;2022-07-24 14:24:53.285251;Zweifamilienhaus in ruhiger Lage an der Wabe;499000;155.0;6;725;Straße nicht freigegeben;38108;Braunschweig;Querum;Mehrfamilienhaus;1 Geschoss;Zustand: renovierungsbedürftig / sanierungsbedürftig ;voll unterkellert, Dach ausbaufähig ;;1962;H;Garten, Balkon 
https://www.immowelt.de/expose/25wyl5k;2022-07-24 14:24:53.992074;Sanieren oder Neubau! in Querum;319000;80.0;4;601;Straße nicht freigegeben;38108;Braunschweig;Querum;Einfamilienhaus;2 ;;teilweise unterkellert ;;1960;;Garten, Balkon 
https://www.immowelt.de/expose/26rc659;2022-07-24 14:24:54.658228;Direkt vom Eigentümer - Provisionsfrei ins Traumhaus;480000;125.0;6;849;Straße nicht freigegeben;38108;Braunschweig;Kralenriede;Einfamilienhaus;2 ;Zustand: renovierungsbedürftig / sanierungsbedürftig ;voll unterkellert ;;1991;E;Terrasse, Garten 
