url;zeitpunkt;titel;preis;wohnflaeche;anz_zimmer;grundstueckflaeche;strasse;plz;stadt;stadtteil;kategorie;anz_stockwerke;zustand;keller;typ;baujahr;energieeffizienz;aussenbereich
https://www.immowelt.de/expose/26sht56;2022-07-20 12:09:06.285352;Repräsentative Fabrikanten-Villa mit Schwimmbad, Garagen, Garten, Holzofen und zwei Wohnungen!;580000.0;270.86;9;2183;Straße nicht freigegeben;31707;BadEilsen;;Einfamilienhaus;;Zustand: gepflegt ;voll unterkellert ;;1977.0;;
https://www.immowelt.de/expose/264s35f;2022-07-20 12:09:07.074717;Ein Primus seiner Klasse! Sackgassenlage mit Fernblick auf das Wesergebirge!;510000.0;192.0;5;839;Straße nicht freigegeben;31707;Heeßen;;Einfamilienhaus;;;;Massivhaus;2003.0;C;Terrasse, Garten 
https://www.immowelt.de/expose/24f6t5z;2022-07-20 12:09:07.729070;2 Familienhaus mit großem Grundstück, genießen Sie Ihre neue Idylle (TK-5819);398000.0;137.0;8;1080;Straße nicht freigegeben;29336;Nienhagen;;Einfamilienhaus;;Zustand: gepflegt ;voll unterkellert ;;1959.0;H;Terrasse 
https://www.immowelt.de/expose/26r7f5d;2022-07-20 12:09:08.353292;Familienleben auf einer Ebene im kommenden Baugeb. in Wathlingen.;247200.0;130.0;5;kA  Grundstücksfl  ;Kantallee ;29336;Nienhagen;;Bungalow;1 Geschoss;Zustand: Neubau ;;Massivhaus;2022.0;;
https://www.immowelt.de/expose/26tjs5c;2022-07-20 12:09:08.912560;Kleines Mehrfamilienhaus mit Photovoltaikanlage;530000.0;300.0;10;879;Straße nicht freigegeben;29336;Nienhagen;;Mehrfamilienhaus;2 ;Zustand: renoviert ;;;;;
https://www.immowelt.de/expose/26m2d5c;2022-07-20 12:09:09.525747;Viel Raum und viele Möglichkeiten;484000.0;275.0;9;1316;Straße nicht freigegeben;29336;Nienhagen;;Mehrfamilienhaus;;;teilweise unterkellert ;;1926.0;F;Terrasse, Garten 
https://www.immowelt.de/expose/26fg957;2022-07-20 12:09:10.184697;Gepflegte Doppelhaushälfte am Feldrand in Papenhorst!;350000.0;108.48;4;491;Straße nicht freigegeben;29336;Nienhagen;;Doppelhaushälfte;;Zustand: gepflegt ;nicht unterkellert ;;1997.0;D;Terrasse 
https://www.immowelt.de/expose/26vxh5e;2022-07-20 12:09:10.836505;Naturverbunden wohnen im kommenden Baugeb. in Wathlingen.;244270.0;117.0;4;kA  Grundstücksfl  ;Kantallee;29336;Nienhagen;;Einfamilienhaus;;Zustand: Neubau ;;Massivhaus;2022.0;;
https://www.immowelt.de/expose/258qw5k;2022-07-20 12:09:11.452103;Haus mit Charakter - Garten mit Flair;408000.0;122.0;4;891;Straße nicht freigegeben;29336;Nienhagen;;Einfamilienhaus;;;nicht unterkellert ;;1991.0;E;Terrasse, Garten, Balkon 
https://www.immowelt.de/expose/25fta5e;2022-07-20 12:09:12.043837;Traumhaft schön modernisiertes / renoviertes Zweifamilienhaus in sehr guter Wohnlage von Nienhagen;620000.0;216.0;8;500;Straße nicht freigegeben;29336;Nienhagen;;Mehrfamilienhaus;;;voll unterkellert ;;1974.0;E;Terrasse, Garten 
https://www.immowelt.de/expose/25yra5e;2022-07-20 12:09:25.155023;Traumhaft schön modernisiertes / renoviertes Zweifamilienhaus in sehr guter Wohnlage von Nienhagen;620000.0;216.0;8;500;Straße nicht freigegeben;29336;Nienhagen;;Mehrfamilienhaus;;;voll unterkellert ;;1974.0;E;Terrasse, Garten 
https://www.immowelt.de/expose/245lk5p;2022-07-20 12:09:25.729438;NEUER PREIS!!! Provisionsfrei für Käufer !!!Großzügiges Einfamilienhaus mit traumhaften Garten, Photovoltailkanlage und weiteren Extras;420000.0;143.75;4,5;1210;Straße nicht freigegeben;29336;Nienhagen;;Einfamilienhaus;;Zustand: gepflegt ;voll unterkellert ;Massivhaus;1976.0;;Terrasse, Garten, Wintergarten 
https://www.immowelt.de/expose/266qv5e;2022-07-20 12:09:26.392131;Idyllisches Einfamilienhaus mit viel Potential zum Selbstverwirklichen!;399000.0;160.0;4;1000;Straße nicht freigegeben;29336;Nienhagen;;Einfamilienhaus;;Zustand: gepflegt ;voll unterkellert ;;1976.0;G;Terrasse, Garten, Balkon 
https://www.immowelt.de/expose/24s7t57;2022-07-20 12:09:27.072490;Einfamilienhaus mit Tiefgarage zu verkaufen!;289000.0;110.0;5;593;Straße nicht freigegeben;29336;Nienhagen;;Einfamilienhaus;;Zustand: gepflegt ;voll unterkellert ;Massivhaus;1957.0;H;
https://www.immowelt.de/expose/266k65f;2022-07-20 12:09:27.704033;Provisionsfrei ! Ideal geeignet für eine große Familie,  6 Zi. - DHH inkl. Garage  in ruhiger Wohnlage!;540000.0;227.0;6;520;Straße nicht freigegeben;29336;CelleNienhagen;;Doppelhaushälfte;;;nicht unterkellert ;Massivhaus;2020.0;B;Terrasse, Garten 
https://www.immowelt.de/expose/24fmq5v;2022-07-20 12:09:28.263717;Einzigartige Landhausvilla auf parkähnlichem Grundstück;1690000.0;325.0;9;2400;Straße nicht freigegeben;29336;Nienhagen;;Villa;;Zustand: renoviert ;nicht unterkellert ;;1994.0;;Terrasse 
https://www.immowelt.de/expose/266mv5a;2022-07-20 12:09:28.870737;Für alle, die es großzügig lieben. Ihr Familienhaus im kommenden Baugeb. in Wathlingen.;250770.0;132.0;5;kA  Grundstücksfl  ;Kantallee;29336;Nienhagen;;Einfamilienhaus;;Zustand: Neubau ;;Massivhaus;2022.0;;
https://www.immowelt.de/expose/26f555g;2022-07-20 12:09:30.731999;Provisionsfrei - Zweifamilienhaus in Neuenkirchen zu verkaufen;255000.0;211.0;6;621;Straße nicht freigegeben;49434;NeuenkirchenVörden;;Mehrfamilienhaus;;Zustand: renovierungsbedürftig ;;;1996.0;;
https://www.immowelt.de/expose/26cfd5b;2022-07-20 12:09:31.367778;Exklusives Einfamilienhaus mit viel Platz und Ausbaureserve sowie einem großen Garten mit Weitblick!;499000.0;262.0;7;1210;Straße nicht freigegeben;49434;NeuenkirchenVörden;;Einfamilienhaus;;;voll unterkellert ;Massivhaus;1996.0;C;Terrasse, Garten, Balkon 
https://www.immowelt.de/expose/259lr5l;2022-07-20 12:09:32.076233;**RESERVIERT** Wunderschöne Doppelhaushälfte mit toller Gartenoase erwartet Sie!;299000.0;121.94;5;525;Straße nicht freigegeben;49434;NeuenkirchenVörden;;Doppelhaushälfte;;Zustand: gepflegt ;nicht unterkellert ;;1997.0;E;Terrasse, Wintergarten 
https://www.immowelt.de/expose/256a956;2022-07-20 12:09:32.986134;*** Verkauft *** Raumwunder in Neuenkirchen;;224.0;8;692;Straße nicht freigegeben;49434;NeuenkirchenVörden;;Einfamilienhaus;;Zustand: gepflegt ;;;1997.0;C;Terrasse, Balkon 
https://www.immowelt.de/expose/25wtb5e;2022-07-20 12:09:33.649199;Attraktives EFH mit Terrassengarten und Balkon in toller Lage;459900.0;180.0;6;998;Straße nicht freigegeben;49434;NeuenkirchenVörden;;Einfamilienhaus;;;voll unterkellert ;;1968.0;F;Terrasse, Garten, Balkon, Wintergarten 
https://www.immowelt.de/expose/254nx5z;2022-07-20 12:09:34.270576;Ein schönes & gepflegtes Reihenmittelhaus mit viel Platz wartet auf neue Eigentümer!;285000.0;130.35;5;144;Straße nicht freigegeben;49434;NeuenkirchenVörden;;Reihenmittelhaus;;Zustand: gepflegt ;nicht unterkellert ;;1996.0;D;Terrasse 
https://www.immowelt.de/expose/26r555g;2022-07-20 12:09:34.866430;Provisionsfrei - Renovierungsbedürftiges Zweifamilienhaus in Neuenkirchen-Vörden zu verkaufen;255000.0;300.0;6;874;Straße nicht freigegeben;49434;NeuenkirchenVörden;;Mehrfamilienhaus;;Zustand: renovierungsbedürftig ;;;1950.0;;
https://www.immowelt.de/expose/26mlj5e;2022-07-20 12:09:35.498106;Kapitalanleger aufgepasst! 2 vermietete MFH mit 11 WE's, Garten, Terrassen, Balkon und Stellplätzen;1499112.0;654.0;22;2000;Straße nicht freigegeben;49434;NeuenkirchenVörden;;Mehrfamilienhaus;;Zustand: gepflegt ;nicht unterkellert ;;2006.0;D;Terrasse, Garten, Balkon 
https://www.immowelt.de/expose/23gyq55;2022-07-20 12:09:36.130228;Holzhaus mit Ausbaumöglichkeit zum bezahlbaren Preis.;260000.0;100.0;2;562;Straße nicht freigegeben;49434;NeuenkirchenVörden;;Einfamilienhaus;1 Geschoss;Zustand: renovierungsbedürftig ;nicht unterkellert ;;2005.0;D;Terrasse, Garten 
