url;zeitpunkt;titel;preis;wohnflaeche;anz_zimmer;grundstueckflaeche;strasse;plz;stadt;stadtteil;kategorie;anz_stockwerke;zustand;keller;typ;baujahr;energieeffizienz;aussenbereich
https://www.immowelt.de/expose/26wmg5d;2022-07-20 12:08:35.325730;Modernes freistehendes Einfamilienhaus in idyllischer Wohnlage ***Provisionsfrei***;449000.0;145.0;5,5;893;Straße nicht freigegeben;29576;Barum;;Einfamilienhaus;2 ;Zustand: Neubau ;nicht unterkellert ;;2013.0;;Terrasse, Garten 
https://www.immowelt.de/expose/26btp53;2022-07-20 12:08:35.953378;WOHNEN, wo andere Urlaub machen!;285000.0;130.0;6;898;Straße nicht freigegeben;29576;Barum;;Einfamilienhaus;;Zustand: gepflegt ;;Massivhaus;1972.0;E;
https://www.immowelt.de/expose/25x4952;2022-07-20 12:08:36.548234;SCHÖNES WOHNEN IM GRÜNEN;365000.0;180.0;6;1250;Straße nicht freigegeben;29576;TätendorfEppensen;;Einfamilienhaus;;Zustand: Altbau (bis 1945) ;voll unterkellert ;;1956.0;;Balkon 
https://www.immowelt.de/expose/26j4656;2022-07-20 12:08:37.181670;*** Dieser attraktive, modernisierte Winkelbungalow wird Sie begeistern ***;369000.0;97.25;4;716;Straße nicht freigegeben;49124;Georgsmarienhütte;Alt-Georgsmarienhütte;Bungalow;;;;;1972.0;F;
https://www.immowelt.de/expose/25tqw5t;2022-07-20 12:08:37.767710;4,56% Rendite inflationsgeschützt - MFH mit 24 Wohnungen;2980000.0;1591.0;k.A.;2547;Straße nicht freigegeben;49124;Georgsmarienhütte;Alt-Georgsmarienhütte;Mehrfamilienhaus;4 ;;voll unterkellert ;;1975.0;A;
https://www.immowelt.de/expose/25f8l5n;2022-07-20 12:08:38.359887;Handwerker aufgepasst: Einfamilienhaus bietet viel Potential;389000.0;185.0;7;772;Straße nicht freigegeben;49124;Georgsmarienhütte;Oesede;Einfamilienhaus;;;;;1927.0;H;
https://www.immowelt.de/expose/25dzk5f;2022-07-20 12:08:38.949979;Kaufen - einziehen - wohlfühlen!;489000.0;120.0;4;501;Straße nicht freigegeben;49124;Georgsmarienhütte;Holsten-Mündrup;Bungalow;;;;;2006.0;B;
https://www.immowelt.de/expose/2682g5e;2022-07-20 12:08:39.591218;Familien aufgepasst: Schmuckstück mit großem Garten in Kloster Oesede!;579000.0;286.14;8;934;Straße nicht freigegeben;49124;Georgsmarienhütte;Kloster Oesede;Einfamilienhaus;;Zustand: renoviert ;nicht unterkellert ;;1976.0;G;Terrasse, Balkon 
https://www.immowelt.de/expose/22tlj5z;2022-07-20 12:08:40.349721;Hier geht die Rechnung auf! Rentables Mehrfamilienhaus in Georgsmarienhütte!;299999.0;246.0;10;499;Straße nicht freigegeben;49124;Georgsmarienhütte;Oesede;Mehrfamilienhaus;;;voll unterkellert ;;;;
https://www.immowelt.de/expose/26rmj58;2022-07-20 12:08:40.963352;Modernisiertes Zweifamilienhaus in Holzhausen mit Ausbaupotenzial!;;390.0;11;981;Straße nicht freigegeben;49124;Georgsmarienhütte;Holzhausen;Mehrfamilienhaus;;;;;1999.0;D;
https://www.immowelt.de/expose/2wnhf4c;2022-07-20 12:08:41.637218;Seltene Kaufgelegenheit in Georgsmarienhütte;850000.0;343.0;k.A.;5681;Straße nicht freigegeben;49124;Georgsmarienhütte;Oesede;Villa;3 ;Zustand: gepflegt ;teilweise unterkellert ;Massivhaus;1973.0;;Terrasse, Garten, Balkon 
https://www.immowelt.de/expose/24j265k;2022-07-20 12:08:42.231611;Laufend saniertes ZFH mit Potenzial! Georgsmarienhütte;469000.0;237.0;4;814;Straße nicht freigegeben;49124;Georgsmarienhütte;Oesede;Mehrfamilienhaus;2 ;;;;1913.0;;Terrasse 
https://www.immowelt.de/expose/26qbz5e;2022-07-20 12:08:42.817933;IDYLLISCH GELEGENE WOHLFÜHLOASE;595000.0;160.0;6;640;Straße nicht freigegeben;49124;Georgsmarienhütte;Alt-Georgsmarienhütte;Einfamilienhaus;;;voll unterkellert ;;;;Terrasse, Balkon 
https://www.immowelt.de/expose/26yqn5f;2022-07-20 12:08:43.334085;2 junge, moderne MFH (Doppelhaus) in 49124 GMH;840000.0;472.0;k.A.;635;Zum Tannenkamp 1B/C;49124;Georgsmarienhütte;Oesede;Mehrfamilienhaus;;;;;1996.0;;
https://www.immowelt.de/expose/254qs5s;2022-07-20 12:08:43.910920;Luxuriöses Einfamilienhaus in Georgsmarienhütte;820000.0;170.0;5;610;Straße nicht freigegeben;49124;Georgsmarienhütte;Oesede;Einfamilienhaus;;;voll unterkellert ;;2017.0;;
https://www.immowelt.de/expose/26t6k5e;2022-07-20 12:08:44.503712;Sofort verfügbar: Ihre Möglichkeit auf einen Bungalow mit Traumgarten!;329000.0;127.93;5;713;Straße nicht freigegeben;49124;Georgsmarienhütte;Kloster Oesede;Bungalow;;;voll unterkellert ;;1976.0;;Terrasse 
https://www.immowelt.de/expose/24le55k;2022-07-20 12:08:45.102995;Geschmackvoll und vielseitig !;231070.0;115.02;4;kA  Grundstücksfl  ;Straße nicht freigegeben;29386;Dedelstorf;Langwedel;Einfamilienhaus;1 Geschoss;Zustand: Erstbezug, Neubau ;;Massivhaus;2022.0;;
https://www.immowelt.de/expose/26r9g5d;2022-07-20 12:08:45.746374;Geräumiges Familienhaus mit Ausbaureserve in Hankensbüttel;499000.0;252.0;6;950;Straße nicht freigegeben;29386;Hankensbüttel;;Einfamilienhaus;;Zustand: Neubau ;voll unterkellert ;Massivhaus;1955.0;E;
https://www.immowelt.de/expose/252585z;2022-07-20 12:08:46.527005;Kleines, gepflegtes Haus in Dedelstorf mit viel Grundstück;245000.0;88.0;4;1398;Stille Heide 147;29386;Dedelstorf;Langwedel;Einfamilienhaus;;Zustand: gepflegt, Neubau ;voll unterkellert ;Massivhaus;1984.0;E;Garten, Balkon 
https://www.immowelt.de/expose/246j75t;2022-07-20 12:08:47.139843;Kleines, gepflegtes Haus in Dedelstorf mit viel Grundstück;245000.0;88.0;4;1398;Stille Heide 147;29386;Dedelstorf;Langwedel;Einfamilienhaus;;Zustand: gepflegt, Neubau ;voll unterkellert ;Massivhaus;1984.0;E;Garten, Balkon 
https://www.immowelt.de/expose/25b5l5c;2022-07-20 12:08:47.752151;Charmantes großzügiges Einfamilienhaus mit Platz zum Wohnen und Arbeiten;320000.0;160.0;6;685;Straße nicht freigegeben;29386;Hankensbüttel;;Einfamilienhaus;;Zustand: gepflegt ;;Massivhaus;1969.0;G;Terrasse, Garten 
https://www.immowelt.de/expose/25y485z;2022-07-20 12:08:48.373798;Kleines, gepflegtes Haus in Dedelstorf mit viel Grundstück;245000.0;88.0;4;1398;Stille Heide 147;29386;Dedelstorf;Langwedel;Einfamilienhaus;;Zustand: gepflegt, Neubau ;voll unterkellert ;Massivhaus;1984.0;E;Garten, Balkon 
https://www.immowelt.de/expose/25w485z;2022-07-20 12:08:48.977477;Kleines, gepflegtes Haus in Dedelstorf mit viel Grundstück;245000.0;88.0;4;1398;Stille Heide 147;29386;Dedelstorf;Langwedel;Einfamilienhaus;;Zustand: gepflegt, Neubau ;voll unterkellert ;Massivhaus;1984.0;E;Garten, Balkon 
https://www.immowelt.de/expose/265ag5d;2022-07-20 12:08:49.573689;Geräumiges Familienhaus mit Ausbaureserve in Hankensbüttel;499000.0;252.0;6;950;Straße nicht freigegeben;29386;Hankensbüttel;;Einfamilienhaus;;Zustand: Neubau ;voll unterkellert ;Massivhaus;1955.0;E;
https://www.immowelt.de/expose/26jyh5c;2022-07-20 12:08:50.266377;Ehemaliger Bauernhof mit Altbaucharme und vielseitigen Nutzungsmöglichkeiten;295000.0;250.0;10;9051;Straße nicht freigegeben;29386;Obernholz;Wierstorf;Bauernhaus;;Zustand: Altbau (bis 1945) ;teilweise unterkellert ;Massivhaus;1900.0;G;
https://www.immowelt.de/expose/26s9g5d;2022-07-20 12:08:50.902387;Geräumiges Familienhaus mit Ausbaureserve in Hankensbüttel;499000.0;252.0;6;950;Straße nicht freigegeben;29386;Hankensbüttel;;Einfamilienhaus;;Zustand: Neubau ;voll unterkellert ;Massivhaus;1955.0;E;
https://www.immowelt.de/expose/26x9m52;2022-07-20 12:08:51.580084;Ein Unikat für Individualisten! Einzigartiges Wohnen in einem Architektenhaus in traumhafter Lage.;290000.0;150.0;5;1615;Straße nicht freigegeben;29386;Hankensbüttel;;Einfamilienhaus;;Zustand: gepflegt ;;Massivhaus;1960.0;H;Terrasse, Garten, Balkon 
https://www.immowelt.de/expose/26ln459;2022-07-20 12:08:52.187589;Urlaub zu Hause! Solides Einfamilienhaus mit ELW, Vollkeller und Traumgrundstück;298000.0;78.0;5;2409;Straße nicht freigegeben;29386;Dedelstorf;Langwedel;Einfamilienhaus;;Zustand: gepflegt ;voll unterkellert ;;1977.0;F;Terrasse, Garten 
https://www.immowelt.de/expose/2526k5w;2022-07-20 12:08:52.903794;Schmuckes Zweifamilienhaus mit überdachter Terrasse, Balkon und Garage in guter Lage von Hankensbüttel;199000.0;115.0;5;794;Straße nicht freigegeben;29386;Hankensbüttel;;Mehrfamilienhaus;;Zustand: gepflegt ;voll unterkellert ;Massivhaus;1964.0;H;Terrasse, Garten, Balkon 
https://www.immowelt.de/expose/242j75t;2022-07-20 12:08:53.505111;Kleines, gepflegtes Haus in Dedelstorf mit viel Grundstück;245000.0;88.0;4;1398;Stille Heide 147;29386;Dedelstorf;Langwedel;Einfamilienhaus;;Zustand: gepflegt, Neubau ;voll unterkellert ;Massivhaus;1984.0;E;Garten, Balkon 
https://www.immowelt.de/expose/258gj5w;2022-07-20 12:08:54.110255;Eine besondere Immobilie! Gemütliches Einfamilienhaus in zentrumsnaher Lage von Hankensbüttel.;215000.0;120.0;4;282;Straße nicht freigegeben;29386;Hankensbüttel;;Einfamilienhaus;;Zustand: Altbau (bis 1945), gepflegt ;teilweise unterkellert ;Massivhaus;1919.0;;Terrasse, Garten 
https://www.immowelt.de/expose/26qsx5a;2022-07-20 12:08:54.777829;Ein Traum! Top gepflegtes Holzhaus auf großzügigem Grundstück im Herzen der Lüneburger Heide;198000.0;79.0;3;1450;Straße nicht freigegeben;29386;Dedelstorf;Langwedel;Bungalow;;Zustand: gepflegt ;nicht unterkellert ;;1981.0;E;Terrasse, Garten 
https://www.immowelt.de/expose/26q9g5d;2022-07-20 12:08:55.373121;Geräumiges Familienhaus mit Ausbaureserve in Hankensbüttel;499000.0;252.0;6;950;Straße nicht freigegeben;29386;Hankensbüttel;;Einfamilienhaus;;Zustand: Neubau ;voll unterkellert ;Massivhaus;1955.0;E;
